model,type,family,run_idx,sentence,reason
claude-sonnet-4.6,LLM,claude,3,The report that the editor that the journalist that the source that the spy contacted trusted reviewed published caused controversy.,wrong length: 20 words (expected 12 or 15)
claude-sonnet-4.6,LLM,claude,3,The book that the critic that the reader that the friend that Mary trusted recommended liked praised sold millions.,wrong length: 19 words (expected 12 or 15)
claude-sonnet-4.6,LLM,claude,3,The house that the agent that the buyer that the bank that the investor funded approved hired sold burned down.,wrong length: 20 words (expected 12 or 15)
claude-sonnet-4.6,LLM,claude,3,The letter that the lawyer that the client that the judge that the jury questioned sentenced hired wrote arrived yesterday.,wrong length: 20 words (expected 12 or 15)
claude-sonnet-4.6,LLM,claude,4,The cat that the dog that the mouse that the bird that the fish saw chased bit scratched yawned.,wrong length: 19 words (expected 12 or 15)
claude-sonnet-4.6,LLM,claude,4,The lawyer that the judge that the witness that the jury that the bailiff summoned watched questioned hired argued.,wrong length: 19 words (expected 12 or 15)
claude-sonnet-4.6,LLM,claude,4,The teacher that the student that the child that the parent that the principal called enrolled taught inspired lectured.,wrong length: 19 words (expected 12 or 15)
claude-sonnet-4.6,LLM,claude,4,The detective that the captain that the suspect that the witness that the officer interviewed frightened implicated promoted investigated.,wrong length: 19 words (expected 12 or 15)
claude-sonnet-4.6,LLM,claude,4,The scientist that the professor that the graduate that the colleague that the dean appointed supervised trained mentored published.,wrong length: 19 words (expected 12 or 15)
claude-sonnet-4.6,LLM,claude,5,The dog that the cat that the mouse that the elephant chased caught bit barked growled ran.,wrong length: 17 words (expected 12 or 15)
claude-sonnet-4.6,LLM,claude,5,The lawyer that the judge that the clerk that the bailiff summoned called questioned argued objected ruled.,wrong length: 17 words (expected 12 or 15)
claude-sonnet-4.6,LLM,claude,5,The student that the teacher that the principal that the board hired fired tested cheated struggled failed.,wrong length: 17 words (expected 12 or 15)
claude-sonnet-4.6,LLM,claude,5,The soldier that the general that the colonel that the captain commanded ordered trained fought bled surrendered.,wrong length: 17 words (expected 12 or 15)
claude-sonnet-4.6,LLM,claude,5,The child that the mother that the father that the grandparent raised disciplined held cried laughed slept.,wrong length: 17 words (expected 12 or 15)
claude-sonnet-4.6,LLM,claude,6,The rat the cat the dog chased caught ate.,wrong length: 9 words (expected 12 or 15)
claude-sonnet-4.6,LLM,claude,6,The book the student the teacher praised read won.,wrong length: 9 words (expected 12 or 15)
claude-sonnet-4.6,LLM,claude,6,The fish the shark the diver spotted chased fled.,wrong length: 9 words (expected 12 or 15)
claude-sonnet-4.6,LLM,claude,8,The cat that the dog that the boy owned chased fled.,wrong length: 11 words (expected 12 or 15)
claude-sonnet-4.6,LLM,claude,8,The report that the committee that the director that the board appointed formed reviewed was flawed.,wrong length: 16 words (expected 12 or 15)
claude-sonnet-4.6,LLM,claude,8,The book that the professor that the student that the dean praised admired wrote won an award.,wrong length: 17 words (expected 12 or 15)
claude-sonnet-4.6,LLM,claude,8,The proposal that the team that the manager that the CEO hired assembled drafted was rejected.,wrong length: 16 words (expected 12 or 15)
claude-sonnet-4.6,LLM,claude,9,The report that the editor that the journalist that the source that the whistleblower contacted trusted wrote reviewed leaked.,wrong length: 19 words (expected 12 or 15)
claude-sonnet-4.6,LLM,claude,9,The bone that the dog that the boy that the girl that the teacher taught liked owned buried crumbled.,wrong length: 19 words (expected 12 or 15)
claude-sonnet-4.6,LLM,claude,9,The song that the band that the producer that the label that the investor funded signed discovered recorded topped the charts.,wrong length: 21 words (expected 12 or 15)
claude-sonnet-4.6,LLM,claude,9,The letter that the lawyer that the client that the judge that the jury trusted appointed hired wrote arrived late.,wrong length: 20 words (expected 12 or 15)
claude-sonnet-4.6,LLM,claude,10,The cake the chef the critic the editor the publisher hired reviewed baked crumbled.,wrong length: 14 words (expected 12 or 15)
claude-sonnet-4.6,LLM,claude,10,The car the mechanic the dealer the banker the lawyer sued hired fixed broke.,wrong length: 14 words (expected 12 or 15)
claude-sonnet-4.6,LLM,claude,10,The letter the secretary the boss the client the judge the lawyer consulted hired wrote burned.,wrong length: 16 words (expected 12 or 15)
claude-sonnet-4.6,LLM,claude,11,The cat that the dog that the boy that the girl loved owned chased scratched the wall.,wrong length: 17 words (expected 12 or 15)
claude-sonnet-4.6,LLM,claude,11,The lawyer that the judge that the clerk that the bailiff summoned addressed ruled against lost the case.,wrong length: 18 words (expected 12 or 15)
claude-sonnet-4.6,LLM,claude,11,The horse that the trainer that the owner that the investor funded hired broke fled the stable.,wrong length: 17 words (expected 12 or 15)
claude-sonnet-4.6,LLM,claude,12,The rat the cat the dog chased caught ate.,wrong length: 9 words (expected 12 or 15)
claude-sonnet-4.6,LLM,claude,12,The bone the dog the child the woman the man loved married raised found buried.,"pos 3 is ""dog"", expected det (the/a)"
claude-sonnet-4.6,LLM,claude,12,The fish the shark the diver the boat the storm wrecked carried spotted hunted swallowed.,"pos 3 is ""shark"", expected det (the/a)"
claude-sonnet-4.6,LLM,claude,12,The letter the lawyer the judge the clerk the bailiff the officer the chief appointed hired summoned escorted supervised signed arrived.,wrong length: 21 words (expected 12 or 15)
claude-sonnet-4.6,LLM,claude,13,The cake the child the parent the baker the judge praised hired made ate crumbled.,"pos 3 is ""child"", expected det (the/a)"
claude-sonnet-4.6,LLM,claude,13,The letter the spy the general the president the council trusted appointed sent received burned.,"pos 3 is ""spy"", expected det (the/a)"
claude-sonnet-4.6,LLM,claude,13,The song the fan the singer the producer the label the executive signed approved recorded performed loved faded.,wrong length: 18 words (expected 12 or 15)
claude-sonnet-4.6,LLM,claude,14,The rat the cat the dog chased killed ate the malt.,wrong length: 11 words (expected 12 or 15)
claude-sonnet-4.6,LLM,claude,14,The book the student the professor the dean appointed taught read won an award.,wrong length: 14 words (expected 12 or 15)
claude-sonnet-4.6,LLM,claude,14,The cake the chef the critic the editor the publisher hired praised trained baked tasted wonderful.,wrong length: 16 words (expected 12 or 15)
claude-sonnet-4.6,LLM,claude,15,The cat that the dog that the boy owned chased fled.,wrong length: 11 words (expected 12 or 15)
claude-sonnet-4.6,LLM,claude,15,The book that the scholar that the university hired wrote won.,wrong length: 11 words (expected 12 or 15)
claude-sonnet-4.6,LLM,claude,15,The letter that the woman that the man loved sent arrived.,wrong length: 11 words (expected 12 or 15)
claude-sonnet-4.6,LLM,claude,15,The fish that the shark that the diver photographed ate died.,wrong length: 11 words (expected 12 or 15)
claude-sonnet-4.6,LLM,claude,15,The song that the band that the label signed recorded charted.,wrong length: 11 words (expected 12 or 15)
claude-sonnet-4.6,LLM,claude,19,The letter that the clerk that the manager that the director appointed supervised filed was lost.,wrong length: 16 words (expected 12 or 15)
claude-sonnet-4.6,LLM,claude,19,The report that the analyst that the supervisor that the executive recruited trained wrote was published.,wrong length: 16 words (expected 12 or 15)
claude-sonnet-4.6,LLM,claude,20,The cat that the dog that the child chased bit scratched the furniture.,wrong length: 13 words (expected 12 or 15)
claude-sonnet-4.6,LLM,claude,20,The report that the editor that the journalist that the intern interviewed hired approved was published.,wrong length: 16 words (expected 12 or 15)
claude-sonnet-4.6,LLM,claude,20,The letter that the lawyer that the judge that the clerk summoned questioned wrote was sealed.,wrong length: 16 words (expected 12 or 15)
claude-sonnet-4.6,LLM,claude,20,The song that the musician that the producer that the agent signed discovered recorded became famous.,wrong length: 16 words (expected 12 or 15)
claude-sonnet-4.6,LLM,claude,21,The cat that the dog that the child chased bit scratched the table.,wrong length: 13 words (expected 12 or 15)
claude-sonnet-4.6,LLM,claude,21,The lawyer that the judge that the jury that the prosecutor convinced acquitted hired won the case.,wrong length: 17 words (expected 12 or 15)
claude-sonnet-4.6,LLM,claude,21,The book that the critic that the editor that the author trusted hired praised became famous.,wrong length: 16 words (expected 12 or 15)
claude-sonnet-4.6,LLM,claude,24,The cat that the dog that the child owned chased scratched the furniture.,wrong length: 13 words (expected 12 or 15)
claude-sonnet-4.6,LLM,claude,24,The report that the editor that the journalist that the intern hired reviewed approved was published.,wrong length: 16 words (expected 12 or 15)
claude-sonnet-4.6,LLM,claude,24,The cake that the chef that the woman that the man loved married baked burned in the oven.,wrong length: 18 words (expected 12 or 15)
claude-sonnet-4.6,LLM,claude,24,The letter that the lawyer that the firm that the client trusted hired wrote was dismissed by the judge.,wrong length: 19 words (expected 12 or 15)
claude-sonnet-4.6,LLM,claude,24,The song that the producer that the label that the investor funded signed discovered became a worldwide hit.,wrong length: 18 words (expected 12 or 15)
claude-sonnet-4.6,LLM,claude,25,The cat that the dog that the boy owned chased climbed the tree.,wrong length: 13 words (expected 12 or 15)
claude-sonnet-4.6,LLM,claude,25,The report that the editor that the journalist that the agency hired trained reviewed was published.,wrong length: 16 words (expected 12 or 15)
claude-sonnet-4.6,LLM,claude,25,The book that the critic that the professor that the university employed respected praised became famous.,wrong length: 16 words (expected 12 or 15)
claude-sonnet-4.6,LLM,claude,26,The consultant that the manager that the CEO hired trained resigned unexpectedly.,"pos 2 is ""that"", expected det (the/a)"
claude-sonnet-4.6,LLM,claude,26,The analyst that the supervisor that the executive that the shareholders elected promoted hired delivered outstanding results.,wrong length: 17 words (expected 12 or 15)
claude-sonnet-4.6,LLM,claude,26,The intern that the coach that the trainer that the firm that the investors funded recruited hired mentored succeeded brilliantly.,wrong length: 20 words (expected 12 or 15)
claude-sonnet-4.6,LLM,claude,26,The specialist that the lead that the coordinator that the manager that the president selected hired trained mentored transformed the entire organization.,wrong length: 22 words (expected 12 or 15)
claude-sonnet-4.6,LLM,claude,29,The cat that the dog that the child that the teacher scolded loved chased scratched the furniture yesterday.,wrong length: 18 words (expected 12 or 15)
claude-sonnet-4.6,LLM,claude,29,The report that the editor that the journalist that the source that the spy contacted trusted revised published caused a scandal.,wrong length: 21 words (expected 12 or 15)
claude-sonnet-4.6,LLM,claude,29,The cake that the guest that the host that the chef that the critic praised hired invited ate tasted wonderful.,wrong length: 20 words (expected 12 or 15)
claude-sonnet-4.6,LLM,claude,29,The bill that the senator that the lobbyist that the corporation that the scandal implicated funded pressured introduced failed immediately.,wrong length: 20 words (expected 12 or 15)
claude-sonnet-4.6,LLM,claude,29,The song that the producer that the manager that the agent that the label signed represented hired recorded became a classic.,wrong length: 21 words (expected 12 or 15)
claude-sonnet-4.6,LLM,claude,30,The rat the cat the dog chased killed ate the malt.,wrong length: 11 words (expected 12 or 15)
claude-sonnet-4.6,LLM,claude,30,The book the student the professor the dean hired taught read won an award.,wrong length: 14 words (expected 12 or 15)
claude-sonnet-4.6-think,LRM,claude,1,The cat that the dog that the rat that the cheese that the mouse ate attracted chased bit died.,wrong length: 19 words (expected 12 or 15)
claude-sonnet-4.6-think,LRM,claude,1,The book that the professor that the student that the idea that the researcher proposed inspired impressed wrote won.,wrong length: 19 words (expected 12 or 15)
claude-sonnet-4.6-think,LRM,claude,1,The house that the man that the woman that the child that the teacher taught adored married built collapsed.,wrong length: 19 words (expected 12 or 15)
claude-sonnet-4.6-think,LRM,claude,1,The song that the band that the label that the investor that the banker funded backed signed recorded charted.,wrong length: 19 words (expected 12 or 15)
claude-sonnet-4.6-think,LRM,claude,1,The castle that the king that the knight that the squire that the lord knighted trained served built stood.,wrong length: 19 words (expected 12 or 15)
claude-sonnet-4.6-think,LRM,claude,2,The book the student the teacher the principal hired fired read was boring.,wrong length: 13 words (expected 12 or 15)
claude-sonnet-4.6-think,LRM,claude,3,The rat the cat the dog the man the woman hired trained bit chased fled.,"pos 3 is ""cat"", expected det (the/a)"
claude-sonnet-4.6-think,LRM,claude,3,The letter the secretary the manager the CEO the board hired promoted assigned typed arrived.,"pos 3 is ""secretary"", expected det (the/a)"
claude-sonnet-4.6-think,LRM,claude,3,The fish the shark the whale the diver the scientist observed discovered hunted ate swam.,"pos 3 is ""shark"", expected det (the/a)"
claude-sonnet-4.6-think,LRM,claude,3,The melody the musician the conductor the patron the critic praised hired selected performed lingered.,"pos 3 is ""musician"", expected det (the/a)"
claude-sonnet-4.6-think,LRM,claude,3,The case the lawyer the judge the clerk the bailiff escorted summoned assigned argued settled.,"pos 3 is ""lawyer"", expected det (the/a)"
claude-sonnet-4.6-think,LRM,claude,5,The malt the rat the cat the dog chased killed ate was stale.,wrong length: 13 words (expected 12 or 15)
claude-sonnet-4.6-think,LRM,claude,5,The book the student the professor the dean hired taught read was fascinating.,wrong length: 13 words (expected 12 or 15)
claude-sonnet-4.6-think,LRM,claude,5,The cheese the mouse the cat the farmer owned chased ate was old.,wrong length: 13 words (expected 12 or 15)
claude-sonnet-4.6-think,LRM,claude,5,The award the athlete the coach the director hired trained won was prestigious.,wrong length: 13 words (expected 12 or 15)
claude-sonnet-4.6-think,LRM,claude,6,The proposal that the analyst that the manager that the director hired supervised reviewed was approved.,wrong length: 16 words (expected 12 or 15)
claude-sonnet-4.6-think,LRM,claude,6,The contract that the associate that the partner that the CEO recruited mentored drafted was signed.,wrong length: 16 words (expected 12 or 15)
claude-sonnet-4.6-think,LRM,claude,6,The report that the consultant that the executive that the board appointed oversaw compiled was published.,wrong length: 16 words (expected 12 or 15)
claude-sonnet-4.6-think,LRM,claude,6,The budget that the accountant that the CFO that the president promoted supervised prepared was accepted.,wrong length: 16 words (expected 12 or 15)
claude-sonnet-4.6-think,LRM,claude,6,The presentation that the intern that the supervisor that the VP selected trained delivered was praised.,wrong length: 16 words (expected 12 or 15)
claude-sonnet-4.6-think,LRM,claude,7,The mouse the cat the dog the man kept chased killed ate the cheese.,wrong length: 14 words (expected 12 or 15)
claude-sonnet-4.6-think,LRM,claude,8,The rat the cat the dog the mouse the bird watched scared chased bit ran.,"pos 3 is ""cat"", expected det (the/a)"
claude-sonnet-4.6-think,LRM,claude,8,The woman the man the child the teacher the principal scolded taught helped married smiled.,"pos 3 is ""man"", expected det (the/a)"
claude-sonnet-4.6-think,LRM,claude,8,The house the builder the architect the client the investor funded hired designed built stood.,"pos 3 is ""builder"", expected det (the/a)"
claude-sonnet-4.6-think,LRM,claude,8,The book the student the professor the dean the president appointed promoted assigned read sold.,"pos 3 is ""student"", expected det (the/a)"
claude-sonnet-4.6-think,LRM,claude,8,The boy the girl the teacher the parent the principal called reprimanded taught liked laughed.,"pos 3 is ""girl"", expected det (the/a)"
claude-sonnet-4.6-think,LRM,claude,10,The engineer that the manager that the CEO hired supervised quit abruptly.,"pos 2 is ""that"", expected det (the/a)"
claude-sonnet-4.6-think,LRM,claude,10,The analyst that the director that the consultant that the board hired fired supervised resigned in protest.,wrong length: 17 words (expected 12 or 15)
claude-sonnet-4.6-think,LRM,claude,10,The intern that the supervisor that the executive hired managed succeeded brilliantly.,"pos 2 is ""that"", expected det (the/a)"
claude-sonnet-4.6-think,LRM,claude,10,The lawyer that the partner that the associate that the client hired recommended supervised won the case.,wrong length: 17 words (expected 12 or 15)
claude-sonnet-4.6-think,LRM,claude,10,The teacher that the principal that the superintendent hired evaluated retired early.,"pos 2 is ""that"", expected det (the/a)"
claude-sonnet-4.6-think,LRM,claude,12,The book the student the teacher the principal hired taught read won an award.,wrong length: 14 words (expected 12 or 15)
claude-sonnet-4.6-think,LRM,claude,13,The song the musician the agent the producer signed managed recorded became famous.,wrong length: 13 words (expected 12 or 15)
claude-sonnet-4.6-think,LRM,claude,14,The malt the rat the cat the dog chased killed ate lay on the floor.,"pos 3 is ""rat"", expected det (the/a)"
claude-sonnet-4.6-think,LRM,claude,14,The book the student the professor the dean hired taught read was fascinating.,wrong length: 13 words (expected 12 or 15)
claude-sonnet-4.6-think,LRM,claude,15,The cheese the rat the cat the dog bit chased ate was moldy.,wrong length: 13 words (expected 12 or 15)
claude-sonnet-4.6-think,LRM,claude,15,The book the student the professor the dean appointed assigned read was fascinating.,wrong length: 13 words (expected 12 or 15)
claude-sonnet-4.6-think,LRM,claude,15,The letter the secretary the boss the director promoted hired typed was long.,wrong length: 13 words (expected 12 or 15)
claude-sonnet-4.6-think,LRM,claude,17,The book that the student that the teacher that the professor that the dean criticized hired taught read won the award.,wrong length: 21 words (expected 12 or 15)
claude-sonnet-4.6-think,LRM,claude,17,The mouse that the cat that the dog that the man that the woman saw owned chased caught squeaked.,wrong length: 19 words (expected 12 or 15)
claude-sonnet-4.6-think,LRM,claude,17,The report that the analyst that the manager that the director that the CEO approved promoted hired reviewed was published.,wrong length: 20 words (expected 12 or 15)
claude-sonnet-4.6-think,LRM,claude,17,The song that the musician that the producer that the label that the critic praised signed mentored recorded became famous.,wrong length: 20 words (expected 12 or 15)
claude-sonnet-4.6-think,LRM,claude,17,The award that the actor that the director that the studio that the critics praised funded cast won was prestigious.,wrong length: 20 words (expected 12 or 15)
claude-sonnet-4.6-think,LRM,claude,18,The rat the cat the dog the man owned chased caught ate the cheese.,wrong length: 14 words (expected 12 or 15)
claude-sonnet-4.6-think,LRM,claude,18,The book the student the professor the dean hired assigned read was fascinating.,wrong length: 13 words (expected 12 or 15)
claude-sonnet-4.6-think,LRM,claude,18,The letter the secretary the manager the CEO appointed hired wrote was important.,wrong length: 13 words (expected 12 or 15)
claude-sonnet-4.6-think,LRM,claude,18,The song the musician the band the label signed recruited recorded became famous.,wrong length: 13 words (expected 12 or 15)
claude-sonnet-4.6-think,LRM,claude,19,The report that the analyst that the manager that the director that the CEO hired supervised promoted reviewed was published.,wrong length: 20 words (expected 12 or 15)
claude-sonnet-4.6-think,LRM,claude,19,The contract that the paralegal that the associate that the partner that the senior partner hired supervised mentored reviewed was signed.,wrong length: 21 words (expected 12 or 15)
claude-sonnet-4.6-think,LRM,claude,19,The blueprint that the architect that the engineer that the contractor that the inspector certified supervised consulted designed was approved.,wrong length: 20 words (expected 12 or 15)
claude-sonnet-4.6-think,LRM,claude,19,The prescription that the intern that the resident that the specialist that the physician hired supervised trained wrote was filled.,wrong length: 20 words (expected 12 or 15)
claude-sonnet-4.6-think,LRM,claude,19,The budget that the accountant that the manager that the director that the CFO appointed evaluated supervised prepared was approved.,wrong length: 20 words (expected 12 or 15)
claude-sonnet-4.6-think,LRM,claude,20,The rat the cat the dog the boy owned chased killed ate the malt.,wrong length: 14 words (expected 12 or 15)
claude-sonnet-4.6-think,LRM,claude,20,The book the professor the student the librarian helped taught wrote won the award.,wrong length: 14 words (expected 12 or 15)
claude-sonnet-4.6-think,LRM,claude,20,The cake the chef the apprentice the farmer trained hired baked pleased the judges.,wrong length: 14 words (expected 12 or 15)
claude-sonnet-4.6-think,LRM,claude,20,The paper the scientist the student the dean supervised mentored published changed the field.,wrong length: 14 words (expected 12 or 15)
claude-sonnet-4.6-think,LRM,claude,20,The film the director the actor the agent represented cast made won the Oscar.,wrong length: 14 words (expected 12 or 15)
claude-sonnet-4.6-think,LRM,claude,21,The paper the student the professor the dean praised supervised wrote was published.,wrong length: 13 words (expected 12 or 15)
claude-sonnet-4.6-think,LRM,claude,21,The house the family the realtor the architect hired showed bought was renovated.,wrong length: 13 words (expected 12 or 15)
claude-sonnet-4.6-think,LRM,claude,21,The award the athlete the coach the committee nominated trained received was prestigious.,wrong length: 13 words (expected 12 or 15)
claude-sonnet-4.6-think,LRM,claude,21,The song the musician the label the critic praised signed recorded became famous.,wrong length: 13 words (expected 12 or 15)
claude-sonnet-4.6-think,LRM,claude,23,The dog the cat the rat the mouse bit chased killed ate the cheese.,wrong length: 14 words (expected 12 or 15)
claude-sonnet-4.6-think,LRM,claude,23,The book the student the teacher the principal praised hired read won an award.,wrong length: 14 words (expected 12 or 15)
claude-sonnet-4.6-think,LRM,claude,23,The song the musician the producer the label signed discovered performed became famous.,wrong length: 13 words (expected 12 or 15)
claude-sonnet-4.6-think,LRM,claude,24,The lawyer that the doctor that the engineer that the teacher hired examined advised won the case.,wrong length: 17 words (expected 12 or 15)
claude-sonnet-4.6-think,LRM,claude,24,The surgeon that the professor that the architect that the nurse trained supervised consulted published the findings.,wrong length: 17 words (expected 12 or 15)
claude-sonnet-4.6-think,LRM,claude,24,The journalist that the senator that the banker that the officer recruited funded interviewed broke the story.,wrong length: 17 words (expected 12 or 15)
claude-sonnet-4.6-think,LRM,claude,24,The chef that the critic that the manager that the investor hired praised recommended earned the award.,wrong length: 17 words (expected 12 or 15)
claude-sonnet-4.6-think,LRM,claude,24,The pilot that the captain that the mechanic that the inspector certified trained praised landed the plane safely.,wrong length: 18 words (expected 12 or 15)
claude-sonnet-4.6-think,LRM,claude,27,The malt the rat the cat the dog chased killed ate was stale.,wrong length: 13 words (expected 12 or 15)
claude-sonnet-4.6-think,LRM,claude,27,The book the student the professor the dean hired taught read was fascinating.,wrong length: 13 words (expected 12 or 15)
claude-sonnet-4.6-think,LRM,claude,27,The paper the researcher the university the government funded supported wrote was groundbreaking.,wrong length: 13 words (expected 12 or 15)
claude-sonnet-4.6-think,LRM,claude,27,The report the analyst the firm the investor funded hired wrote was accurate.,wrong length: 13 words (expected 12 or 15)
claude-sonnet-4.6-think,LRM,claude,27,The house the architect the company the client hired employed designed was beautiful.,wrong length: 13 words (expected 12 or 15)
claude-sonnet-4.6-think,LRM,claude,28,The rat the cat the dog the man owned chased killed ate the malt.,wrong length: 14 words (expected 12 or 15)
