model,type,family,run_idx,sentence,reason
claude-sonnet-4.6-think,LRM,claude,28,The book the student the teacher the professor praised taught read won an award.,wrong length: 14 words (expected 12 or 15)
claude-sonnet-4.6-think,LRM,claude,28,The song the musician the producer the label signed discovered recorded became famous.,wrong length: 13 words (expected 12 or 15)
claude-sonnet-4.6-think,LRM,claude,30,The dog the cat the rat the mouse the flea bit chased caught killed barked.,"pos 3 is ""cat"", expected det (the/a)"
claude-sonnet-4.6-think,LRM,claude,30,The man the woman the child the baby the nurse fed held loved married smiled.,"pos 3 is ""woman"", expected det (the/a)"
claude-sonnet-4.6-think,LRM,claude,30,The paper the researcher the professor the committee the board selected appointed supervised wrote won.,"pos 3 is ""researcher"", expected det (the/a)"
claude-sonnet-4.6-think,LRM,claude,30,The award the athlete the coach the trainer the doctor examined helped trained won inspired.,"pos 3 is ""athlete"", expected det (the/a)"
claude-sonnet-4.6-think,LRM,claude,30,The song the singer the producer the manager the agent contacted hired coached recorded became a hit.,wrong length: 17 words (expected 12 or 15)
deepseek-r1,LRM,deepseek,5,The book that the student that the teacher praised studied fascinated everyone.,"pos 2 is ""that"", expected det (the/a)"
deepseek-r1,LRM,deepseek,5,The painting that the artist that the gallery featured created won a prize.,wrong length: 13 words (expected 12 or 15)
deepseek-r1,LRM,deepseek,5,The code that the developer that the company hired wrote functioned perfectly.,"pos 2 is ""that"", expected det (the/a)"
deepseek-r1,LRM,deepseek,5,The meal that the chef that the critic admired prepared delighted diners.,"pos 2 is ""that"", expected det (the/a)"
deepseek-r1,LRM,deepseek,5,The house that the builder that the architect designed constructed stood sturdily.,"pos 2 is ""that"", expected det (the/a)"
deepseek-r1,LRM,deepseek,7,"The sun, the clouds, the rain, the rainbow appeared, poured, drifted, shone.",pattern mismatch
deepseek-r1,LRM,deepseek,10,The painting that the curator that the artist that the gallery sponsored admired purchased became famous.,wrong length: 16 words (expected 12 or 15)
deepseek-r1,LRM,deepseek,10,The software that the developer that the company that the investor funded hired designed transformed the industry.,wrong length: 17 words (expected 12 or 15)
deepseek-r1,LRM,deepseek,11,The dog chases the ball and the ball rolls.,coordination (and/or)
deepseek-r1,LRM,deepseek,11,The wind shakes the leaves and the leaves fall.,coordination (and/or)
deepseek-r1,LRM,deepseek,11,The chef stirs the pot and the pot bubbles.,coordination (and/or)
deepseek-r1,LRM,deepseek,11,The child waters the plant and the plant grows.,coordination (and/or)
deepseek-r1,LRM,deepseek,11,The artist paints the canvas and the canvas dries.,coordination (and/or)
deepseek-r1,LRM,deepseek,12,"The mountain, the river, the forest, and the valley echoed, flowed, rustled, and towered.",coordination (and/or)
deepseek-r1,LRM,deepseek,12,"The chef, the gardener, the painter, and the musician composed, planted, brushed, and stirred.",coordination (and/or)
deepseek-r1,LRM,deepseek,12,"The clock, the book, the lamp, and the chair ticked, opened, glowed, and stood.",coordination (and/or)
deepseek-r1,LRM,deepseek,12,"The eagle, the dolphin, the lion, and the antelope soared, swam, roared, and grazed.",coordination (and/or)
deepseek-r1,LRM,deepseek,12,"The storm, the rainbow, the dew, and the frost raged, arched, glistened, and melted.",coordination (and/or)
deepseek-r1,LRM,deepseek,13,The princess loves the prince.,wrong length: 5 words (expected 12 or 15)
deepseek-r1,LRM,deepseek,13,The prince advises the queen.,wrong length: 5 words (expected 12 or 15)
deepseek-r1,LRM,deepseek,13,The queen obeys the king.,wrong length: 5 words (expected 12 or 15)
deepseek-r1,LRM,deepseek,13,The king rules.,wrong length: 3 words (expected 12 or 15)
deepseek-r1,LRM,deepseek,13,The king loves the queen.,wrong length: 5 words (expected 12 or 15)
deepseek-r1,LRM,deepseek,14,The pebble shifted slightly.,wrong length: 4 words (expected 12 or 15)
deepseek-r1,LRM,deepseek,14,The leaf fluttered downward.,wrong length: 4 words (expected 12 or 15)
deepseek-r1,LRM,deepseek,14,The squirrel scampered away.,wrong length: 4 words (expected 12 or 15)
deepseek-r1,LRM,deepseek,14,The architect drafted new plans.,wrong length: 5 words (expected 12 or 15)
deepseek-r1,LRM,deepseek,14,The director orchestrated the entire event.,wrong length: 6 words (expected 12 or 15)
deepseek-r1,LRM,deepseek,15,The teacher instructed the student completed the principal approved the janitor repaired.,"pos 2 is ""instructed"", expected det (the/a)"
deepseek-r1,LRM,deepseek,15,The chef prepared the waiter served the manager scheduled the supplier delivered.,"pos 2 is ""prepared"", expected det (the/a)"
deepseek-r1,LRM,deepseek,15,The author wrote the editor reviewed the publisher approved the printer published.,"pos 2 is ""wrote"", expected det (the/a)"
deepseek-r1,LRM,deepseek,15,The captain commanded the crew navigated the officer organized the mechanic fixed.,"pos 2 is ""commanded"", expected det (the/a)"
deepseek-r1,LRM,deepseek,15,The director filmed the actor performed the producer funded the designer created.,"pos 2 is ""filmed"", expected det (the/a)"
deepseek-r1,LRM,deepseek,16,The dog bites the cat.,wrong length: 5 words (expected 12 or 15)
deepseek-r1,LRM,deepseek,16,The cat scratches the mouse.,wrong length: 5 words (expected 12 or 15)
deepseek-r1,LRM,deepseek,16,The mouse nibbles the cheese.,wrong length: 5 words (expected 12 or 15)
deepseek-r1,LRM,deepseek,16,The cheese sits.,wrong length: 3 words (expected 12 or 15)
deepseek-r1,LRM,deepseek,16,This ends the chain.,wrong length: 4 words (expected 12 or 15)
deepseek-r1,LRM,deepseek,17,"Four nouns: king, queen, knight, dragon and four verbs: guarded, advised, ruled, slept.",coordination (and/or)
deepseek-r1,LRM,deepseek,17,The dragon guarded the knight.,wrong length: 5 words (expected 12 or 15)
deepseek-r1,LRM,deepseek,17,The knight advised the queen.,wrong length: 5 words (expected 12 or 15)
deepseek-r1,LRM,deepseek,17,The queen ruled the king.,wrong length: 5 words (expected 12 or 15)
deepseek-r1,LRM,deepseek,17,The king slept.,wrong length: 3 words (expected 12 or 15)
deepseek-r1,LRM,deepseek,20,The professor that the student that the dean praised admired published groundbreaking research.,wrong length: 13 words (expected 12 or 15)
deepseek-r1,LRM,deepseek,20,The dog that the cat that the mouse terrified chased barked loudly at the mail carrier.,wrong length: 16 words (expected 12 or 15)
deepseek-r1,LRM,deepseek,20,The artist that the gallery that the investors funded featured painted a stunning mural downtown.,"pos 9 is ""featured"", expected det (the/a)"
deepseek-r1,LRM,deepseek,20,The engineer that the company that the CEO founded hired designed an efficient new prototype.,"pos 9 is ""hired"", expected det (the/a)"
deepseek-r1,LRM,deepseek,20,The cake that the baker that the critic applauded baked won first prize at the competition.,wrong length: 16 words (expected 12 or 15)
deepseek-r1,LRM,deepseek,21,The chef who prepared the meal that included the sauce which used the spices cooked.,relative pronoun: who
deepseek-r1,LRM,deepseek,21,The gardener who planted the flowers that attracted the bees which pollinated the trees grew.,relative pronoun: who
deepseek-r1,LRM,deepseek,21,The writer who drafted the story that featured the character who solved the mystery published.,relative pronoun: who
deepseek-r1,LRM,deepseek,21,The mechanic who fixed the car that had the engine which burned the oil repaired.,relative pronoun: who
deepseek-r1,LRM,deepseek,21,The artist who painted the portrait that depicted the scene which captured the light exhibited.,relative pronoun: who
deepseek-r1,LRM,deepseek,22,The dog ran.,wrong length: 3 words (expected 12 or 15)
deepseek-r1,LRM,deepseek,22,The cat jumped.,wrong length: 3 words (expected 12 or 15)
deepseek-r1,LRM,deepseek,22,The car drove.,wrong length: 3 words (expected 12 or 15)
deepseek-r1,LRM,deepseek,22,The house slept.,wrong length: 3 words (expected 12 or 15)
deepseek-r1,LRM,deepseek,22,The dog slept.,wrong length: 3 words (expected 12 or 15)
deepseek-r1,LRM,deepseek,26,"The universe, the galaxy, the solar system, the planet; twitch, rotate, orbit, expand.",wrong length: 13 words (expected 12 or 15)
deepseek-r1,LRM,deepseek,27,"The squire commanded the knight, the knight advised the queen, the queen warned the king, and the king rested.",coordination (and/or)
deepseek-r1,LRM,deepseek,27,"The parent called the principal, the principal emailed the student, the student met the teacher, and the teacher left.",coordination (and/or)
deepseek-r1,LRM,deepseek,27,"The wind blew the leaves, the leaves rustled the branches, the branches shook the tree, and the tree fell.",coordination (and/or)
deepseek-r1,LRM,deepseek,27,"The customer called the waiter, the waiter greeted the assistant, the assistant notified the chef, and the chef departed.",coordination (and/or)
deepseek-r1,LRM,deepseek,27,"The lion chased the tiger, the tiger scared the wolf, the wolf cornered the rabbit, and the rabbit escaped.",coordination (and/or)
deepseek-r1,LRM,deepseek,28,"The chef prepared the meal, and the meal simmered.",coordination (and/or)
deepseek-r1,LRM,deepseek,28,"The wind shook the tree, the tree dropped the fruit, and the fruit rolled.",coordination (and/or)
deepseek-r1,LRM,deepseek,28,"The director instructed the actor, the actor mimicked the stuntman, the stuntman performed the leap, and the leap astonished.",coordination (and/or)
deepseek-r1,LRM,deepseek,28,"The programmer debugged the code, the code executed the function, and the function completed.",coordination (and/or)
deepseek-r1,LRM,deepseek,28,"The audience applauded the singer, the singer thanked the band, the band packed the instruments, and the instruments rested.",coordination (and/or)
deepseek-r1,LRM,deepseek,29,The cake that the baker that the customer praised made delighted everyone.,"pos 2 is ""that"", expected det (the/a)"
deepseek-r1,LRM,deepseek,29,The report that the analyst that the manager supervised wrote impressed the board.,wrong length: 13 words (expected 12 or 15)
deepseek-r1,LRM,deepseek,29,The painting that the artist that the gallery featured created received acclaim.,"pos 2 is ""that"", expected det (the/a)"
deepseek-r1,LRM,deepseek,29,The software that the developer that the company hired designed transformed operations.,"pos 2 is ""that"", expected det (the/a)"
deepseek-r1,LRM,deepseek,29,The theory that the scientist that the university honored proposed revolutionized physics.,"pos 2 is ""that"", expected det (the/a)"
deepseek-r1,LRM,deepseek,30,The king that commanded the general that led the army that defeated the enemy that surrendered celebrated victory.,wrong length: 18 words (expected 12 or 15)
deepseek-r1,LRM,deepseek,30,The girl that walked the dog that chased the ball that broke the window that shattered cried loudly.,wrong length: 18 words (expected 12 or 15)
deepseek-r1,LRM,deepseek,30,The scientist that designed the experiment that used the equipment that collected the data that verified published the findings.,wrong length: 19 words (expected 12 or 15)
deepseek-r1,LRM,deepseek,30,The artist that held the brush that stroked the canvas that created the painting that inspired received acclaim.,wrong length: 18 words (expected 12 or 15)
deepseek-r1,LRM,deepseek,30,The farmer that drove the tractor that plowed the field that planted the seeds that grew harvested the crops.,wrong length: 19 words (expected 12 or 15)
deepseek-v3,LLM,deepseek,1,"The dog barked, alerting the cat.",wrong length: 6 words (expected 12 or 15)
deepseek-v3,LLM,deepseek,1,"The cat hissed, startling the bird.",wrong length: 6 words (expected 12 or 15)
deepseek-v3,LLM,deepseek,1,"The bird flew, escaping the danger.",wrong length: 6 words (expected 12 or 15)
deepseek-v3,LLM,deepseek,1,"The wind blew, shaking the tree.",wrong length: 6 words (expected 12 or 15)
deepseek-v3,LLM,deepseek,1,"The tree swayed, dropping its leaves.",wrong length: 6 words (expected 12 or 15)
deepseek-v3,LLM,deepseek,2,"The dog barked, the cat hissed, the bird chirped.",wrong length: 9 words (expected 12 or 15)
deepseek-v3,LLM,deepseek,2,"The wind blew, the leaves rustled, the branches swayed.",wrong length: 9 words (expected 12 or 15)
deepseek-v3,LLM,deepseek,2,"The chef chopped, the pan sizzled, the aroma wafted.",wrong length: 9 words (expected 12 or 15)
deepseek-v3,LLM,deepseek,2,"The waves crashed, the sand shifted, the shells scattered.",wrong length: 9 words (expected 12 or 15)
deepseek-v3,LLM,deepseek,2,"The engine roared, the tires spun, the dust swirled.",wrong length: 9 words (expected 12 or 15)
deepseek-v3,LLM,deepseek,3,The chef's assistant's knife sliced chopped diced.,wrong length: 7 words (expected 12 or 15)
deepseek-v3,LLM,deepseek,3,The artist's canvas's paint dripped smeared blurred.,wrong length: 7 words (expected 12 or 15)
deepseek-v3,LLM,deepseek,3,The teacher's student's notebook scribbled filled erased.,wrong length: 7 words (expected 12 or 15)
deepseek-v3,LLM,deepseek,3,The gardener's tool's blade cut pruned trimmed.,wrong length: 7 words (expected 12 or 15)
deepseek-v3,LLM,deepseek,3,The engineer's blueprint's design sketched drafted revised.,wrong length: 7 words (expected 12 or 15)
deepseek-v3,LLM,deepseek,4,The cat the mouse the cheese the trap caught nibbled sprang.,wrong length: 11 words (expected 12 or 15)
deepseek-v3,LLM,deepseek,4,The king the castle the gate the guard commanded guarded watched.,wrong length: 11 words (expected 12 or 15)
deepseek-v3,LLM,deepseek,4,The teacher the student the book the page read flipped scanned.,wrong length: 11 words (expected 12 or 15)
deepseek-v3,LLM,deepseek,4,The chef the kitchen the pot the soup stirred tasted served.,wrong length: 11 words (expected 12 or 15)
deepseek-v3,LLM,deepseek,4,The artist the canvas the brush the paint applied blended admired.,wrong length: 11 words (expected 12 or 15)
deepseek-v3,LLM,deepseek,5,The dog that chased the cat that climbed the tree barked loudly.,"pos 2 is ""that"", expected det (the/a)"
deepseek-v3,LLM,deepseek,5,The teacher who praised the student who solved the problem smiled warmly.,relative pronoun: who
deepseek-v3,LLM,deepseek,5,The car that hit the bike that blocked the lane screeched to a halt.,wrong length: 14 words (expected 12 or 15)
deepseek-v3,LLM,deepseek,5,The chef who cooked the meal that pleased the guests received applause.,relative pronoun: who
deepseek-v3,LLM,deepseek,5,The book that inspired the author who wrote the story became famous.,relative pronoun: who
deepseek-v3,LLM,deepseek,6,"The shadow crept, merged, faded, vanished.",wrong length: 6 words (expected 12 or 15)
deepseek-v3,LLM,deepseek,6,"The flame flickered, dwindled, extinguished, disappeared.",wrong length: 6 words (expected 12 or 15)
deepseek-v3,LLM,deepseek,6,"The echo bounced, softened, faded, dissolved.",wrong length: 6 words (expected 12 or 15)
deepseek-v3,LLM,deepseek,6,"The figure turned, walked, faded, vanished.",wrong length: 6 words (expected 12 or 15)
deepseek-v3,LLM,deepseek,6,"The mist swirled, thinned, evaporated, disappeared.",wrong length: 6 words (expected 12 or 15)
deepseek-v3,LLM,deepseek,7,A baker kneads dough to prepare it for baking.,wrong length: 9 words (expected 12 or 15)
deepseek-v3,LLM,deepseek,7,A chef shapes the dough into loaves before placing them in the oven.,wrong length: 13 words (expected 12 or 15)
deepseek-v3,LLM,deepseek,7,A delivery driver transports the freshly baked bread to a grocery store.,"pos 2 is ""driver"", expected det (the/a)"
deepseek-v3,LLM,deepseek,7,A store clerk arranges the bread on shelves for customers to purchase.,"pos 2 is ""clerk"", expected det (the/a)"
deepseek-v3,LLM,deepseek,7,A customer selects a loaf and takes it home for dinner.,coordination (and/or)
deepseek-v3,LLM,deepseek,9,The cat chases the mouse runs jumps.,wrong length: 7 words (expected 12 or 15)
deepseek-v3,LLM,deepseek,9,The teacher instructs the student writes reads.,wrong length: 7 words (expected 12 or 15)
deepseek-v3,LLM,deepseek,9,The chef prepares the dish cooks serves.,wrong length: 7 words (expected 12 or 15)
deepseek-v3,LLM,deepseek,9,The artist paints the canvas displays attracts.,wrong length: 7 words (expected 12 or 15)
deepseek-v3,LLM,deepseek,9,The gardener plants the flower grows blooms.,wrong length: 7 words (expected 12 or 15)
deepseek-v3,LLM,deepseek,10,A young artist carefully paints a mural on a blank wall.,wrong length: 11 words (expected 12 or 15)
deepseek-v3,LLM,deepseek,10,A passerby stops to admire the mural and adds a small detail.,coordination (and/or)
deepseek-v3,LLM,deepseek,10,"A group of children gathers around, excitedly discussing the artwork.",wrong length: 10 words (expected 12 or 15)
deepseek-v3,LLM,deepseek,10,"An elderly man takes a photo of the mural, smiling warmly.",wrong length: 11 words (expected 12 or 15)
deepseek-v3,LLM,deepseek,10,"Finally, the artist steps back, satisfied with the collaborative effort.",wrong length: 10 words (expected 12 or 15)
deepseek-v3,LLM,deepseek,11,The chef prepared the meal that delighted the guests who praised the host who organized the event.,relative pronoun: who
deepseek-v3,LLM,deepseek,11,The teacher assigned the project that challenged the students who completed the tasks that impressed the principal.,relative pronoun: who
deepseek-v3,LLM,deepseek,11,The artist painted the mural that attracted the tourists who photographed the scene that captured the beauty.,relative pronoun: who
deepseek-v3,LLM,deepseek,11,The writer crafted the story that inspired the readers who shared the tale that entertained the audience.,relative pronoun: who
deepseek-v3,LLM,deepseek,11,The scientist developed the theory that intrigued the colleagues who conducted the experiments that confirmed the hypothesis.,relative pronoun: who
deepseek-v3,LLM,deepseek,12,"The wind blew fiercely, shaking the trees.",wrong length: 7 words (expected 12 or 15)
deepseek-v3,LLM,deepseek,12,A branch snapped and fell onto the road.,coordination (and/or)
deepseek-v3,LLM,deepseek,12,"A car swerved to avoid the branch, skidding off the pavement.",wrong length: 11 words (expected 12 or 15)
deepseek-v3,LLM,deepseek,12,"The car hit a lamppost, causing it to tilt dangerously.",wrong length: 10 words (expected 12 or 15)
deepseek-v3,LLM,deepseek,12,"The tilted lamppost eventually collapsed onto the sidewalk, blocking the path.",wrong length: 11 words (expected 12 or 15)
deepseek-v3,LLM,deepseek,13,The book author story ended.,wrong length: 5 words (expected 12 or 15)
deepseek-v3,LLM,deepseek,13,The car engine noise stopped.,wrong length: 5 words (expected 12 or 15)
deepseek-v3,LLM,deepseek,13,The house roof tile cracked.,wrong length: 5 words (expected 12 or 15)
deepseek-v3,LLM,deepseek,13,The garden flower scent lingered.,wrong length: 5 words (expected 12 or 15)
deepseek-v3,LLM,deepseek,13,The office desk drawer closed.,wrong length: 5 words (expected 12 or 15)
deepseek-v3,LLM,deepseek,14,"The creator sculpts a clay vase, shaping it with precise movements.",wrong length: 11 words (expected 12 or 15)
deepseek-v3,LLM,deepseek,14,"A collaborator paints intricate designs onto the vase, adding vibrant colors.",wrong length: 11 words (expected 12 or 15)
deepseek-v3,LLM,deepseek,14,"An observer carefully inspects the vase, noting its craftsmanship and artistry.",coordination (and/or)
deepseek-v3,LLM,deepseek,14,"As the observer steps back, the vase wobbles and falls to the ground, shattering.",coordination (and/or)
deepseek-v3,LLM,deepseek,14,"The fragments disappear into the earth, leaving no trace of the once-beautiful object.",wrong length: 13 words (expected 12 or 15)
deepseek-v3,LLM,deepseek,15,The teacher who oversees the students explains the lessons that clarify the concepts.,relative pronoun: who
deepseek-v3,LLM,deepseek,15,The chef who prepares the meal tastes the dish that satisfies the customers.,relative pronoun: who
deepseek-v3,LLM,deepseek,15,The engineer who designs the bridge calculates the load that supports the structure.,relative pronoun: who
deepseek-v3,LLM,deepseek,15,The author who writes the book develops the plot that captivates the readers.,relative pronoun: who
deepseek-v3,LLM,deepseek,15,The gardener who plants the flowers waters the soil that nurtures the blooms.,relative pronoun: who
deepseek-v3,LLM,deepseek,18,The book of the author of the novel fascinated readers.,wrong length: 10 words (expected 12 or 15)
deepseek-v3,LLM,deepseek,18,The teacher of the class of the school announced the results.,wrong length: 11 words (expected 12 or 15)
deepseek-v3,LLM,deepseek,18,The car of the driver of the race accelerated quickly.,wrong length: 10 words (expected 12 or 15)
deepseek-v3,LLM,deepseek,18,The cake of the chef of the bakery delighted the customers.,wrong length: 11 words (expected 12 or 15)
deepseek-v3,LLM,deepseek,18,The dog of the owner of the house barked loudly.,wrong length: 10 words (expected 12 or 15)
deepseek-v3,LLM,deepseek,19,The dog barked and startled the cat.,coordination (and/or)
deepseek-v3,LLM,deepseek,19,The cat jumped and knocked over the vase.,coordination (and/or)
deepseek-v3,LLM,deepseek,19,The vase shattered and alarmed the homeowner.,coordination (and/or)
deepseek-v3,LLM,deepseek,19,The homeowner called and notified the neighbor.,coordination (and/or)
deepseek-v3,LLM,deepseek,19,The neighbor arrived and examined the damage.,coordination (and/or)
deepseek-v3,LLM,deepseek,22,The teacher praised the student who solved the problem that baffled the expert who analyzed the data.,relative pronoun: who
deepseek-v3,LLM,deepseek,22,The chef admired the dish that delighted the critic who sampled the recipe that showcased the technique.,relative pronoun: who
deepseek-v3,LLM,deepseek,22,The author wrote the book that inspired the reader who shared the story that moved the audience.,relative pronoun: who
deepseek-v3,LLM,deepseek,22,The engineer designed the bridge that supported the train that carried the cargo that fueled the economy.,wrong length: 17 words (expected 12 or 15)
deepseek-v3,LLM,deepseek,22,The gardener tended the plant that attracted the butterfly that pollinated the flower that brightened the garden.,wrong length: 17 words (expected 12 or 15)
deepseek-v3,LLM,deepseek,23,The chef prepared a meal.,wrong length: 5 words (expected 12 or 15)
deepseek-v3,LLM,deepseek,23,The meal delighted the guest.,wrong length: 5 words (expected 12 or 15)
deepseek-v3,LLM,deepseek,23,The guest complimented the host.,wrong length: 5 words (expected 12 or 15)
deepseek-v3,LLM,deepseek,23,The host organized a party.,wrong length: 5 words (expected 12 or 15)
deepseek-v3,LLM,deepseek,23,The party entertained the neighbors.,wrong length: 5 words (expected 12 or 15)
deepseek-v3,LLM,deepseek,24,The letter the teacher the student the principal handed vanished.,wrong length: 10 words (expected 12 or 15)
deepseek-v3,LLM,deepseek,24,The key the locksmith the homeowner the landlord gave disappeared.,wrong length: 10 words (expected 12 or 15)
deepseek-v3,LLM,deepseek,24,The package the courier the recipient the neighbor delivered vanished.,wrong length: 10 words (expected 12 or 15)
deepseek-v3,LLM,deepseek,24,The book the librarian the reader the friend lent disappeared.,wrong length: 10 words (expected 12 or 15)
deepseek-v3,LLM,deepseek,24,The necklace the jeweler the customer the partner fixed vanished.,wrong length: 10 words (expected 12 or 15)
deepseek-v3,LLM,deepseek,25,The book that contained the map that led to the treasure that was hidden by the pirates disappeared.,wrong length: 18 words (expected 12 or 15)
deepseek-v3,LLM,deepseek,25,The man who owned the dog that chased the cat that climbed the tree shouted.,relative pronoun: who
deepseek-v3,LLM,deepseek,25,The teacher who assigned the project that required the research that explored the theory explained.,relative pronoun: who
deepseek-v3,LLM,deepseek,25,The woman who bought the dress that was designed by the artist that inspired the collection smiled.,relative pronoun: who
deepseek-v3,LLM,deepseek,25,The child who found the toy that belonged to the friend who moved away laughed.,relative pronoun: who
deepseek-v3,LLM,deepseek,26,"The cat, the mouse, the cheese scurried, squeaked, vanished.",wrong length: 9 words (expected 12 or 15)
deepseek-v3,LLM,deepseek,26,"The wind, the leaves, the dust swirled, rustled, disappeared.",wrong length: 9 words (expected 12 or 15)
deepseek-v3,LLM,deepseek,26,"The sun, the clouds, the shadows shifted, drifted, faded.",wrong length: 9 words (expected 12 or 15)
deepseek-v3,LLM,deepseek,26,"The car, the dog, the man sped, barked, vanished.",wrong length: 9 words (expected 12 or 15)
deepseek-v3,LLM,deepseek,26,"The star, the moon, the light twinkled, glowed, disappeared.",wrong length: 9 words (expected 12 or 15)
deepseek-v3,LLM,deepseek,27,The book that my sister recommended started collecting dust.,wrong length: 9 words (expected 12 or 15)
deepseek-v3,LLM,deepseek,27,The cat with the fluffy tail began purring softly.,wrong length: 9 words (expected 12 or 15)
deepseek-v3,LLM,deepseek,27,The car that my father bought suddenly stopped working.,wrong length: 9 words (expected 12 or 15)
deepseek-v3,LLM,deepseek,27,The painting of the old castle attracted many visitors.,wrong length: 9 words (expected 12 or 15)
deepseek-v3,LLM,deepseek,27,The laptop on the desk started beeping loudly.,wrong length: 8 words (expected 12 or 15)
