model,type,family,run_idx,sentence,reason
deepseek-v3,LLM,deepseek,28,A scientist picked up a vial from the lab bench.,wrong length: 10 words (expected 12 or 15)
deepseek-v3,LLM,deepseek,28,The scientist handed the vial to a lab assistant.,wrong length: 9 words (expected 12 or 15)
deepseek-v3,LLM,deepseek,28,The lab assistant placed the vial into a centrifuge.,wrong length: 9 words (expected 12 or 15)
deepseek-v3,LLM,deepseek,28,The centrifuge spun the vial at high speed.,wrong length: 8 words (expected 12 or 15)
deepseek-v3,LLM,deepseek,28,"Finally, the researcher analyzed the contents of the vial.",wrong length: 9 words (expected 12 or 15)
deepseek-v3,LLM,deepseek,29,"The author of the book about the history of the city explored, researched, and wrote.",coordination (and/or)
deepseek-v3,LLM,deepseek,29,"The manager of the team of players trained, coached, and motivated.",coordination (and/or)
deepseek-v3,LLM,deepseek,29,"The owner of the store with the collection of antiques bought, sold, and displayed.",coordination (and/or)
deepseek-v3,LLM,deepseek,29,"The director of the film with the cast of actors rehearsed, filmed, and edited.",coordination (and/or)
deepseek-v3,LLM,deepseek,29,"The teacher of the class with the group of students lectured, explained, and assessed.",coordination (and/or)
deepseek-v3,LLM,deepseek,30,The chef knife tomatoes slice salad.,wrong length: 6 words (expected 12 or 15)
deepseek-v3,LLM,deepseek,30,The wind leaves trees sway dance.,wrong length: 6 words (expected 12 or 15)
deepseek-v3,LLM,deepseek,30,The hammer nail board build fence.,wrong length: 6 words (expected 12 or 15)
deepseek-v3,LLM,deepseek,30,The rain roof gutter flow drain.,wrong length: 6 words (expected 12 or 15)
deepseek-v3,LLM,deepseek,30,The teacher chalkboard lesson inspire students.,wrong length: 6 words (expected 12 or 15)
gemini-3.5-flash,LLM,gemini,2,The report the intern the analyst the manager hired trained reviewed filed was excellent.,wrong length: 14 words (expected 12 or 15)
gemini-3.5-flash,LLM,gemini,2,The song the singer the guitarist the band selected practiced performed dominated the charts.,wrong length: 14 words (expected 12 or 15)
gemini-3.5-flash,LLM,gemini,3,The coder the hacker the security-guard the manager questioned caught locked-out promoted.,"pos 5 is ""security-guard"", expected noun"
gemini-3.5-flash,LLM,gemini,3,The singer the guitarist the drummer the fan annoyed distracted kicked-out thanked.,"pos 10 is ""kicked-out"", expected verb"
gemini-3.5-flash,LLM,gemini,5,The patient the doctor the nurse the patient's family requested assigned treated recovered.,wrong length: 13 words (expected 12 or 15)
gemini-3.5-flash,LLM,gemini,9,The chef the critic the writer the editor praised read disliked was fired.,wrong length: 13 words (expected 12 or 15)
gemini-3.5-flash,LLM,gemini,22,The report the assistant the clerk the intern filed drafted typed revealed a major error.,"pos 3 is ""assistant"", expected det (the/a)"
gemini-3.5-flash,LLM,gemini,22,The mouse the cat the dog the boy chased bit scratched escaped through the fence.,"pos 3 is ""cat"", expected det (the/a)"
gemini-3.5-flash,LLM,gemini,22,The car the mechanic the apprentice the helper hired trained supervised repaired ran perfectly.,wrong length: 14 words (expected 12 or 15)
gemini-3.5-flash,LLM,gemini,22,The song the singer the writer the producer hired inspired advised sang topped the charts.,"pos 3 is ""singer"", expected det (the/a)"
gemini-3.5-flash,LLM,gemini,22,The code the developer the manager the director hired questioned promoted compiled without issues.,wrong length: 14 words (expected 12 or 15)
gemini-3.5-flash,LLM,gemini,24,The hero the monster the girl the boy loved feared defeated saved the day.,wrong length: 14 words (expected 12 or 15)
gemini-3.5-flash,LLM,gemini,28,The book that the student whom the teacher whom the principal hired praised read misplaced has been found.,relative pronoun: whom
gemini-3.5-flash,LLM,gemini,28,The car that the mechanic whom the man whom the police arrested employed repaired crashed.,relative pronoun: whom
gemini-3.5-flash,LLM,gemini,28,The report that the intern whom the manager whom the director promoted supervised wrote vanished.,relative pronoun: whom
gemini-3.5-flash,LLM,gemini,29,The software the programmer the tester the user complained-about evaluated updated crashed.,"pos 8 is ""complained-about"", expected verb"
gemini-3.5-flash-think,LRM,gemini,2,Women men dogs fleas bite hate love sing.,wrong length: 8 words (expected 12 or 15)
gemini-3.5-flash-think,LRM,gemini,2,Chefs patrons critics reviews influence annoy admire retired.,wrong length: 8 words (expected 12 or 15)
gemini-3.5-flash-think,LRM,gemini,2,Students teachers parents taxes anger pressure inspire failed.,wrong length: 8 words (expected 12 or 15)
gemini-3.5-flash-think,LRM,gemini,2,Artists collectors dealers contracts bind exploit praise vanished.,wrong length: 8 words (expected 12 or 15)
gemini-3.5-flash-think,LRM,gemini,2,Children adults bosses deadlines worry employ scold slept.,wrong length: 8 words (expected 12 or 15)
gemini-3.5-flash-think,LRM,gemini,9,The book that the student that the teacher that the principal praised recommended read was lost.,wrong length: 16 words (expected 12 or 15)
gemini-3.5-flash-think,LRM,gemini,9,The food that the guest that the chef that the owner hired served ate was delicious.,wrong length: 16 words (expected 12 or 15)
gemini-3.5-flash-think,LRM,gemini,9,The painting that the artist that the patron that the museum contacted supported painted was sold.,wrong length: 16 words (expected 12 or 15)
glm-4.5,LLM,glm,1,Cats dogs birds mice chased jumped ran flew.,wrong length: 8 words (expected 12 or 15)
glm-4.5,LLM,glm,1,Books pens papers notes wrote read studied learned.,wrong length: 8 words (expected 12 or 15)
glm-4.5,LLM,glm,1,Cars trucks buses vans drove stopped parked turned.,wrong length: 8 words (expected 12 or 15)
glm-4.5,LLM,glm,1,Apples bananas oranges grapes grew ripened fell decayed.,wrong length: 8 words (expected 12 or 15)
glm-4.5,LLM,glm,1,Houses buildings offices towers constructed opened closed renovated.,wrong length: 8 words (expected 12 or 15)
glm-4.5,LLM,glm,2,The cat that chased the mouse that stole the cheese that was left on the counter meowed loudly.,wrong length: 18 words (expected 12 or 15)
glm-4.5,LLM,glm,2,The book that I read that recommended that diet that helped me lose weight changed my life.,wrong length: 17 words (expected 12 or 15)
glm-4.5,LLM,glm,2,The teacher who praised the student who solved the problem that confused everyone received an award.,relative pronoun: who
glm-4.5,LLM,glm,2,The house that Jack built that stood on the hill that overlooked the valley was sold yesterday.,wrong length: 17 words (expected 12 or 15)
glm-4.5,LLM,glm,2,The reporter who interviewed the witness who identified the suspect who committed the crime won a prize.,relative pronoun: who
glm-4.5,LLM,glm,3,The cat that chased the mouse that ate the cheese that was left on the counter meowed loudly.,wrong length: 18 words (expected 12 or 15)
glm-4.5,LLM,glm,3,The book that I bought yesterday that was written by the author who won the prize is fascinating.,relative pronoun: who
glm-4.5,LLM,glm,3,The house that Jack built that stood on the hill that overlooked the village was old and decrepit.,coordination (and/or)
glm-4.5,LLM,glm,3,The student who answered the question that the professor who taught the class asked received an A.,relative pronoun: who
glm-4.5,LLM,glm,3,The car that hit the tree that was planted by the man who lived next door was badly damaged.,relative pronoun: who
glm-4.5,LLM,glm,4,"The detective carefully examined the crime scene, collecting fingerprints from multiple surfaces.","pos 2 is ""carefully"", expected det (the/a)"
glm-4.5,LLM,glm,4,She then photographed each piece of evidence before placing it in separate evidence bags.,wrong length: 14 words (expected 12 or 15)
glm-4.5,LLM,glm,4,"The forensic team analyzed the blood samples, DNA traces, and fiber fragments found at the location.",coordination (and/or)
glm-4.5,LLM,glm,4,"After processing all the objects, they created a detailed report of their findings.",wrong length: 13 words (expected 12 or 15)
glm-4.5,LLM,glm,4,"Finally, the agents submitted the collected evidence chain to the prosecutor for further investigation.",wrong length: 14 words (expected 12 or 15)
glm-4.5,LLM,glm,5,The boy throws the ball.,wrong length: 5 words (expected 12 or 15)
glm-4.5,LLM,glm,5,The boy throws the ball which hits the window.,relative pronoun: which
glm-4.5,LLM,glm,5,The boy throws the ball which hits the window that breaks the glass.,relative pronoun: which
glm-4.5,LLM,glm,5,The boy throws the ball which hits the window that breaks the glass which startles the cat.,relative pronoun: which
glm-4.5,LLM,glm,5,The boy throws the ball which hits the window that breaks the glass which startles the cat that wakes the baby.,relative pronoun: which
glm-4.5,LLM,glm,6,"The teacher instructed the students, who were eagerly listening, to complete their assignments before the deadline.",relative pronoun: who
glm-4.5,LLM,glm,6,"The police officer directed the pedestrians, some of whom were tourists, to clear the intersection immediately.",relative pronoun: whom
glm-4.5,LLM,glm,6,"The manager asked the employees, including those from the remote team, to submit their reports by Friday.",wrong length: 17 words (expected 12 or 15)
glm-4.5,LLM,glm,6,"The doctor advised the patients, particularly those with chronic conditions, to monitor their symptoms closely.","pos 6 is ""those"", expected det (the/a)"
glm-4.5,LLM,glm,6,"The captain warned the passengers, many of whom were first-time flyers, to remain seated during the turbulence.",relative pronoun: whom
glm-4.5,LLM,glm,7,The cat chased the mouse.,wrong length: 5 words (expected 12 or 15)
glm-4.5,LLM,glm,7,The boy kicked the ball.,wrong length: 5 words (expected 12 or 15)
glm-4.5,LLM,glm,7,The teacher graded the papers.,wrong length: 5 words (expected 12 or 15)
glm-4.5,LLM,glm,7,The chef prepared the meal.,wrong length: 5 words (expected 12 or 15)
glm-4.5,LLM,glm,7,The artist painted the canvas.,wrong length: 5 words (expected 12 or 15)
glm-4.5,LLM,glm,8,The agent observed the situation.,wrong length: 5 words (expected 12 or 15)
glm-4.5,LLM,glm,8,The detective investigated the crime scene.,wrong length: 6 words (expected 12 or 15)
glm-4.5,LLM,glm,8,The forensic analyst collected DNA samples from the weapon.,wrong length: 9 words (expected 12 or 15)
glm-4.5,LLM,glm,8,The lab technician extracted and sequenced the genetic material.,coordination (and/or)
glm-4.5,LLM,glm,8,The DNA profiler matched the sample to the suspect in the database.,"pos 2 is ""profiler"", expected det (the/a)"
glm-4.5,LLM,glm,9,The cat observes.,wrong length: 3 words (expected 12 or 15)
glm-4.5,LLM,glm,9,The cat observes the bird.,wrong length: 5 words (expected 12 or 15)
glm-4.5,LLM,glm,9,The cat observes the bird chasing the mouse.,wrong length: 8 words (expected 12 or 15)
glm-4.5,LLM,glm,9,The cat observes the bird chasing the mouse catching the insect.,wrong length: 11 words (expected 12 or 15)
glm-4.5,LLM,glm,9,The cat observes the bird chasing the mouse catching the insect hunting the prey.,wrong length: 14 words (expected 12 or 15)
glm-4.5,LLM,glm,10,The teacher distributes books to eager students.,wrong length: 7 words (expected 12 or 15)
glm-4.5,LLM,glm,10,Children chase colorful balloons across the park.,wrong length: 7 words (expected 12 or 15)
glm-4.5,LLM,glm,10,Mechanics repair engines with specialized tools.,wrong length: 6 words (expected 12 or 15)
glm-4.5,LLM,glm,10,Artists paint vibrant landscapes on canvas.,wrong length: 6 words (expected 12 or 15)
glm-4.5,LLM,glm,10,Scientists analyze data using advanced computers.,wrong length: 6 words (expected 12 or 15)
glm-4.5,LLM,glm,11,"Mountains, rivers, and forests stood tall, flowed freely, and swayed gently.",coordination (and/or)
glm-4.5,LLM,glm,11,"Books, pens, and papers filled the shelves, wrote notes, and covered the desk.",coordination (and/or)
glm-4.5,LLM,glm,11,"Cars, buses, and trains sped down the highway, stopped at stations, and transported passengers.",coordination (and/or)
glm-4.5,LLM,glm,11,"Stars, moons, and planets shone brightly, orbited steadily, and fascinated observers.",coordination (and/or)
glm-4.5,LLM,glm,11,"Cats, dogs, and birds purred softly, barked loudly, and sang sweetly.",coordination (and/or)
glm-4.5,LLM,glm,12,Cats dogs birds fish run jump swim fly.,wrong length: 8 words (expected 12 or 15)
glm-4.5,LLM,glm,12,Children teachers books computers learn read play type.,wrong length: 8 words (expected 12 or 15)
glm-4.5,LLM,glm,12,Cars trains planes bicycles drive speed race pedal.,wrong length: 8 words (expected 12 or 15)
glm-4.5,LLM,glm,12,Sun moon stars clouds shine twinkle glow float.,wrong length: 8 words (expected 12 or 15)
glm-4.5,LLM,glm,12,Water fire earth wind flow burn move blow.,wrong length: 8 words (expected 12 or 15)
glm-4.5,LLM,glm,13,"Cats, dogs, and birds ran, jumped, and flew.",coordination (and/or)
glm-4.5,LLM,glm,13,"Books, pens, and papers opened, wrote, and folded.",coordination (and/or)
glm-4.5,LLM,glm,13,"Cars, buses, and trains started, moved, and stopped.",coordination (and/or)
glm-4.5,LLM,glm,13,"Water, fire, and earth flowed, burned, and grew.",coordination (and/or)
glm-4.5,LLM,glm,13,"Children, teachers, and parents learned, taught, and helped.",coordination (and/or)
glm-4.5,LLM,glm,14,The teacher handed the assignment to the student.,wrong length: 8 words (expected 12 or 15)
glm-4.5,LLM,glm,14,The doctor prescribed medication to the patient.,wrong length: 7 words (expected 12 or 15)
glm-4.5,LLM,glm,14,The chef prepared a delicious meal for the customers.,wrong length: 9 words (expected 12 or 15)
glm-4.5,LLM,glm,14,The police officer issued a ticket to the speeding driver.,wrong length: 10 words (expected 12 or 15)
glm-4.5,LLM,glm,14,The artist painted a beautiful portrait for the client.,wrong length: 9 words (expected 12 or 15)
glm-4.5,LLM,glm,15,Cats dogs birds mice ran jumped flew slept.,wrong length: 8 words (expected 12 or 15)
glm-4.5,LLM,glm,15,Books pens papers desks wrote drew read organized.,wrong length: 8 words (expected 12 or 15)
glm-4.5,LLM,glm,15,Cars trains planes bicycles drove sailed flew pedaled.,wrong length: 8 words (expected 12 or 15)
glm-4.5,LLM,glm,15,Houses buildings bridges roads constructed collapsed repaired expanded.,wrong length: 8 words (expected 12 or 15)
glm-4.5,LLM,glm,15,Teachers students doctors nurses taught studied diagnosed cared.,wrong length: 8 words (expected 12 or 15)
glm-4.5,LLM,glm,16,The cat chased the mouse.,wrong length: 5 words (expected 12 or 15)
glm-4.5,LLM,glm,16,The mouse escaped through the hole.,wrong length: 6 words (expected 12 or 15)
glm-4.5,LLM,glm,16,The dog barked at the stranger.,wrong length: 6 words (expected 12 or 15)
glm-4.5,LLM,glm,16,The stranger ran down the street.,wrong length: 6 words (expected 12 or 15)
glm-4.5,LLM,glm,16,The street light flickered in the darkness.,wrong length: 7 words (expected 12 or 15)
glm-4.5,LLM,glm,17,The cat that the dog that the bird that the worm that the apple chased ate saw scared me.,wrong length: 19 words (expected 12 or 15)
glm-4.5,LLM,glm,17,The teacher that the student that the principal that the school that the district hired supervised taught graded the exam.,wrong length: 20 words (expected 12 or 15)
glm-4.5,LLM,glm,17,The car that the mechanic that the owner that the dealership that the manufacturer sold fixed washed drove away.,wrong length: 19 words (expected 12 or 15)
glm-4.5,LLM,glm,17,The book that the author that the editor that the publisher that the company hired reviewed wrote became a bestseller.,wrong length: 20 words (expected 12 or 15)
glm-4.5,LLM,glm,17,The house that the agent that the buyer that the bank that the government approved inspected listed sold quickly.,wrong length: 19 words (expected 12 or 15)
glm-4.5,LLM,glm,18,Cats dogs birds ran jumped flew.,wrong length: 6 words (expected 12 or 15)
glm-4.5,LLM,glm,18,Books papers pens read wrote drew.,wrong length: 6 words (expected 12 or 15)
glm-4.5,LLM,glm,18,Cars trains planes drove sped soared.,wrong length: 6 words (expected 12 or 15)
glm-4.5,LLM,glm,18,Water juice coffee drank poured sipped.,wrong length: 6 words (expected 12 or 15)
glm-4.5,LLM,glm,18,Sun moon stars shone glowed twinkled.,wrong length: 6 words (expected 12 or 15)
glm-4.5,LLM,glm,19,The cat chased the mouse.,wrong length: 5 words (expected 12 or 15)
glm-4.5,LLM,glm,19,The boy kicked the ball.,wrong length: 5 words (expected 12 or 15)
glm-4.5,LLM,glm,19,The teacher graded the papers.,wrong length: 5 words (expected 12 or 15)
glm-4.5,LLM,glm,19,The chef prepared the meal.,wrong length: 5 words (expected 12 or 15)
glm-4.5,LLM,glm,19,The artist painted the canvas.,wrong length: 5 words (expected 12 or 15)
glm-4.5,LLM,glm,20,The teacher handed the assignment to the student.,wrong length: 8 words (expected 12 or 15)
glm-4.5,LLM,glm,20,The doctor prescribed medication to the patient.,wrong length: 7 words (expected 12 or 15)
glm-4.5,LLM,glm,20,The chef prepared a delicious meal for the customers.,wrong length: 9 words (expected 12 or 15)
glm-4.5,LLM,glm,20,The mail carrier delivered the package to the recipient.,wrong length: 9 words (expected 12 or 15)
glm-4.5,LLM,glm,20,The police officer issued a ticket to the driver.,wrong length: 9 words (expected 12 or 15)
glm-4.5,LLM,glm,21,Cats dogs birds ran jumped flew.,wrong length: 6 words (expected 12 or 15)
glm-4.5,LLM,glm,21,Books pens papers wrote read tore.,wrong length: 6 words (expected 12 or 15)
glm-4.5,LLM,glm,21,Cars trains planes drove sped soared.,wrong length: 6 words (expected 12 or 15)
glm-4.5,LLM,glm,21,Water fire ice flowed burned froze.,wrong length: 6 words (expected 12 or 15)
glm-4.5,LLM,glm,21,Children adults teachers learned taught played.,wrong length: 6 words (expected 12 or 15)
glm-4.5,LLM,glm,22,The house that the architect that the builder that the developer employed designed collapsed.,wrong length: 14 words (expected 12 or 15)
glm-4.5,LLM,glm,23,The cat that the dog that the boy chased chased ran away.,"pos 2 is ""that"", expected det (the/a)"
glm-4.5,LLM,glm,23,The paper that the student that the professor taught submitted was excellent.,"pos 2 is ""that"", expected det (the/a)"
glm-4.5,LLM,glm,23,The house that the man that the woman married built was large.,"pos 2 is ""that"", expected det (the/a)"
glm-4.5,LLM,glm,23,The book that the author that the critic praised wrote became a bestseller.,wrong length: 13 words (expected 12 or 15)
glm-4.5,LLM,glm,23,The car that the mechanic that the owner trusted fixed was expensive.,"pos 2 is ""that"", expected det (the/a)"
glm-4.5,LLM,glm,24,The student completed the assignment.,wrong length: 5 words (expected 12 or 15)
glm-4.5,LLM,glm,24,The chef prepared the meal.,wrong length: 5 words (expected 12 or 15)
glm-4.5,LLM,glm,24,The artist painted the canvas.,wrong length: 5 words (expected 12 or 15)
glm-4.5,LLM,glm,24,The mechanic fixed the engine.,wrong length: 5 words (expected 12 or 15)
glm-4.5,LLM,glm,24,The teacher graded the papers.,wrong length: 5 words (expected 12 or 15)
glm-4.5,LLM,glm,25,The teacher gave a book to the student.,wrong length: 8 words (expected 12 or 15)
glm-4.5,LLM,glm,25,The chef prepared a meal for the customer.,wrong length: 8 words (expected 12 or 15)
glm-4.5,LLM,glm,25,The doctor prescribed medication to the patient.,wrong length: 7 words (expected 12 or 15)
glm-4.5,LLM,glm,25,The mail carrier delivered a package to the homeowner.,wrong length: 9 words (expected 12 or 15)
glm-4.5,LLM,glm,25,The artist painted a portrait for the client.,wrong length: 8 words (expected 12 or 15)
glm-4.5,LLM,glm,26,The student reads the book.,wrong length: 5 words (expected 12 or 15)
glm-4.5,LLM,glm,26,The chef prepares the meal.,wrong length: 5 words (expected 12 or 15)
glm-4.5,LLM,glm,26,The artist paints the canvas.,wrong length: 5 words (expected 12 or 15)
glm-4.5,LLM,glm,26,The mechanic fixes the engine.,wrong length: 5 words (expected 12 or 15)
glm-4.5,LLM,glm,26,The gardener waters the plants.,wrong length: 5 words (expected 12 or 15)
glm-4.5,LLM,glm,27,"The chef chopped the vegetables, sliced the meat, and seasoned the dish.",coordination (and/or)
glm-4.5,LLM,glm,27,"The teacher graded the papers, recorded the scores, and returned the assignments.",coordination (and/or)
glm-4.5,LLM,glm,27,"The child built the tower, knocked it down, and laughed loudly.",coordination (and/or)
glm-4.5,LLM,glm,27,"The mechanic fixed the engine, replaced the filter, and tested the car.",coordination (and/or)
glm-4.5,LLM,glm,27,"The photographer adjusted the settings, focused the lens, and captured the moment.",coordination (and/or)
glm-4.5,LLM,glm,28,Cats dogs birds ran jumped flew.,wrong length: 6 words (expected 12 or 15)
glm-4.5,LLM,glm,28,Books pens papers wrote read stacked.,wrong length: 6 words (expected 12 or 15)
glm-4.5,LLM,glm,28,Cars buses trains drove stopped accelerated.,wrong length: 6 words (expected 12 or 15)
glm-4.5,LLM,glm,28,Water fire ice flowed burned froze.,wrong length: 6 words (expected 12 or 15)
glm-4.5,LLM,glm,28,Children adults played learned laughed.,wrong length: 5 words (expected 12 or 15)
glm-4.5,LLM,glm,29,The teacher gave a book to the student.,wrong length: 8 words (expected 12 or 15)
glm-4.5,LLM,glm,29,The doctor prescribed medicine to the patient.,wrong length: 7 words (expected 12 or 15)
glm-4.5,LLM,glm,29,The chef prepared a meal for the customer.,wrong length: 8 words (expected 12 or 15)
glm-4.5,LLM,glm,29,The mailman delivered a package to the homeowner.,wrong length: 8 words (expected 12 or 15)
glm-4.5,LLM,glm,29,The artist painted a portrait for the client.,wrong length: 8 words (expected 12 or 15)
glm-4.5,LLM,glm,30,Cats dogs birds ran jumped flew.,wrong length: 6 words (expected 12 or 15)
glm-4.5,LLM,glm,30,Books pens papers wrote read folded.,wrong length: 6 words (expected 12 or 15)
glm-4.5,LLM,glm,30,Cars trains planes drove sped soared.,wrong length: 6 words (expected 12 or 15)
glm-4.5,LLM,glm,30,Apples oranges bananas grew ripened fell.,wrong length: 6 words (expected 12 or 15)
glm-4.5,LLM,glm,30,Water fire ice flowed burned froze.,wrong length: 6 words (expected 12 or 15)
glm-4.5-think,LRM,glm,1,The boy runs.,wrong length: 3 words (expected 12 or 15)
glm-4.5-think,LRM,glm,1,A girl jumps.,wrong length: 3 words (expected 12 or 15)
glm-4.5-think,LRM,glm,1,An author writes.,wrong length: 3 words (expected 12 or 15)
glm-4.5-think,LRM,glm,1,The computer computes.,wrong length: 3 words (expected 12 or 15)
glm-4.5-think,LRM,glm,1,The boy runs and jumps.,coordination (and/or)
glm-4.5-think,LRM,glm,2,"The pirate found the treasure, the sailor hid the treasure, the parrot guarded the treasure, and then the treasure was lost.",coordination (and/or)
glm-4.5-think,LRM,glm,2,"The sailor hid the treasure, the pirate found the treasure, the parrot guarded the treasure, and then the treasure was lost.",coordination (and/or)
glm-4.5-think,LRM,glm,2,"The parrot guarded the treasure, the sailor found the treasure, the pirate hid the treasure, and then the treasure was lost.",coordination (and/or)
glm-4.5-think,LRM,glm,2,"The pirate found the treasure, the parrot guarded the treasure, the sailor hid the treasure, and then the treasure was lost.",coordination (and/or)
glm-4.5-think,LRM,glm,2,"The sailor hid the treasure, the parrot guarded the treasure, the pirate found the treasure, and then the treasure was lost.",coordination (and/or)
glm-4.5-think,LRM,glm,3,The sun warms the earth.,wrong length: 5 words (expected 12 or 15)
glm-4.5-think,LRM,glm,3,The earth nourishes the plant.,wrong length: 5 words (expected 12 or 15)
glm-4.5-think,LRM,glm,3,The plant feeds the animal.,wrong length: 5 words (expected 12 or 15)
glm-4.5-think,LRM,glm,3,The animal sleeps.,wrong length: 3 words (expected 12 or 15)
glm-4.5-think,LRM,glm,3,The sun rises.,wrong length: 3 words (expected 12 or 15)
glm-4.5-think,LRM,glm,4,"John kicked the ball, Mary threw the ball, Tom caught the ball, and the ball bounced.",coordination (and/or)
glm-4.5-think,LRM,glm,4,"John kicked the ball, Mary caught the ball, Tom threw the ball, and the ball bounced.",coordination (and/or)
glm-4.5-think,LRM,glm,4,"John threw the ball, Mary kicked the ball, Tom caught the ball, and the ball bounced.",coordination (and/or)
glm-4.5-think,LRM,glm,4,"John threw the ball, Mary caught the ball, Tom kicked the ball, and the ball bounced.",coordination (and/or)
glm-4.5-think,LRM,glm,4,"John caught the ball, Mary kicked the ball, Tom threw the ball, and the ball bounced.",coordination (and/or)
glm-4.5-think,LRM,glm,5,"The seed grew into a plant, which had been watered by the gardener, which had been planted in the soil.",relative pronoun: which
glm-4.5-think,LRM,glm,5,"The letter was received by the editor, which had been sent to the publisher, which had been written by the author.",relative pronoun: which
glm-4.5-think,LRM,glm,5,"The dough was baked in the oven, which had been shaped into a loaf, which had been mixed by the baker.",relative pronoun: which
glm-4.5-think,LRM,glm,5,"The car was driven off the lot, which had been assembled in the factory, which had been designed by the engineer.",relative pronoun: which
glm-4.5-think,LRM,glm,5,"The code was deployed to the server, which had been tested by the QA team, which had been written by the programmer.",relative pronoun: which
glm-4.5-think,LRM,glm,7,The gardener planted the seed.,wrong length: 5 words (expected 12 or 15)
