model,type,family,run_idx,sentence,reason
glm-4.5-think,LRM,glm,7,The gardener watered the soil.,wrong length: 5 words (expected 12 or 15)
glm-4.5-think,LRM,glm,7,The soil nourished the plant.,wrong length: 5 words (expected 12 or 15)
glm-4.5-think,LRM,glm,7,The plant produced the seed.,wrong length: 5 words (expected 12 or 15)
glm-4.5-think,LRM,glm,7,The cycle of life continued.,wrong length: 5 words (expected 12 or 15)
glm-4.5-think,LRM,glm,8,The king reigns.,wrong length: 3 words (expected 12 or 15)
glm-4.5-think,LRM,glm,8,The duke advises the king.,wrong length: 5 words (expected 12 or 15)
glm-4.5-think,LRM,glm,8,The knight protects the duke.,wrong length: 5 words (expected 12 or 15)
glm-4.5-think,LRM,glm,8,The squire serves the knight.,wrong length: 5 words (expected 12 or 15)
glm-4.5-think,LRM,glm,8,The king reigns alone.,wrong length: 4 words (expected 12 or 15)
glm-4.5-think,LRM,glm,9,Four noun phrases and four verbs form the basis of language.,coordination (and/or)
glm-4.5-think,LRM,glm,9,The noun phrases describe subjects and objects clearly.,coordination (and/or)
glm-4.5-think,LRM,glm,9,Four verbs express actions and states dynamically.,coordination (and/or)
glm-4.5-think,LRM,glm,9,The verbs connect the noun phrases meaningfully.,wrong length: 7 words (expected 12 or 15)
glm-4.5-think,LRM,glm,9,Four noun phrases and four verbs create complete thoughts.,coordination (and/or)
glm-4.5-think,LRM,glm,12,"The cat, the dog, the bird, and the fish ran, jumped, flew, and swam.",coordination (and/or)
glm-4.5-think,LRM,glm,12,"The boy, the girl, the man, and the woman laughed, cried, smiled, and frowned.",coordination (and/or)
glm-4.5-think,LRM,glm,12,"The car, the truck, the bus, and the train stopped, started, moved, and halted.",coordination (and/or)
glm-4.5-think,LRM,glm,12,"The book, the pen, the paper, and the desk fell, broke, tore, and opened.",coordination (and/or)
glm-4.5-think,LRM,glm,12,"The sun, the moon, the star, and the cloud rose, set, twinkled, and drifted.",coordination (and/or)
glm-4.5-think,LRM,glm,13,"The storm, lightning, thunder, and wind raged, flashed, roared, and howled.",coordination (and/or)
glm-4.5-think,LRM,glm,13,"The chef, knife, onion, and pot chopped, sizzled, simmered, and boiled.",coordination (and/or)
glm-4.5-think,LRM,glm,13,"The knight, sword, dragon, and castle charged, clashed, roared, and crumbled.",coordination (and/or)
glm-4.5-think,LRM,glm,13,"The seeds, soil, water, and sun sprouted, grew, bloomed, and thrived.",coordination (and/or)
glm-4.5-think,LRM,glm,13,"The detective, clue, suspect, and truth investigated, analyzed, pursued, and revealed.",coordination (and/or)
glm-4.5-think,LRM,glm,15,"The chef chopped the vegetables, the waiter served the vegetables, the customer ate the vegetables, and then the vegetables spoiled.",coordination (and/or)
glm-4.5-think,LRM,glm,15,"The artist painted the canvas, the critic examined the canvas, the buyer purchased the canvas, and then the canvas faded.",coordination (and/or)
glm-4.5-think,LRM,glm,15,"The mechanic fixed the engine, the driver tested the engine, the passenger admired the engine, and then the engine overheated.",coordination (and/or)
glm-4.5-think,LRM,glm,15,"The teacher wrote the lesson, the student read the lesson, the principal reviewed the lesson, and then the lesson confused.",coordination (and/or)
glm-4.5-think,LRM,glm,15,"The gardener planted the seeds, the rain watered the seeds, the sun warmed the seeds, and then the seeds sprouted.",coordination (and/or)
glm-4.5-think,LRM,glm,16,"The ball, Charlie, Bob, Alice, was kicked by Charlie, thrown by Bob, hit by Alice, and rolled by the ball.",coordination (and/or)
glm-4.5-think,LRM,glm,16,"The book, Peter, Mary, John, was read by Peter, written by Mary, published by John, and closed by the book.",coordination (and/or)
glm-4.5-think,LRM,glm,16,"The car, Owner, Mechanic, Driver, was driven by Owner, repaired by Mechanic, washed by Driver, and parked by the car.",coordination (and/or)
glm-4.5-think,LRM,glm,16,"The meal, Customer, Waiter, Chef, was eaten by Customer, served by Waiter, cooked by Chef, and finished by the meal.",coordination (and/or)
glm-4.5-think,LRM,glm,16,"The project, Tester, Developer, Manager, was tested by Tester, developed by Developer, managed by Manager, and completed by the project.",coordination (and/or)
glm-4.5-think,LRM,glm,17,The ball was kicked by the player.,wrong length: 7 words (expected 12 or 15)
glm-4.5-think,LRM,glm,17,The book was written by the author.,wrong length: 7 words (expected 12 or 15)
glm-4.5-think,LRM,glm,17,The meal was prepared by the chef.,wrong length: 7 words (expected 12 or 15)
glm-4.5-think,LRM,glm,17,The song was sung by the choir.,wrong length: 7 words (expected 12 or 15)
glm-4.5-think,LRM,glm,17,The house was built by the construction workers.,wrong length: 8 words (expected 12 or 15)
glm-4.5-think,LRM,glm,18,"The chef, the waiter, and the critic chopped, tasted, seasoned, and presented the dish.",coordination (and/or)
glm-4.5-think,LRM,glm,18,"The teacher, the student, and the principal wrote, read, graded, and discussed the essay.",coordination (and/or)
glm-4.5-think,LRM,glm,18,"The artist, the curator, and the buyer painted, framed, displayed, and purchased the portrait.",coordination (and/or)
glm-4.5-think,LRM,glm,18,"The engineer, the technician, and the inspector designed, assembled, tested, and approved the machine.",coordination (and/or)
glm-4.5-think,LRM,glm,18,"The gardener, the landscaper, and the homeowner planted, watered, pruned, and admired the roses.",coordination (and/or)
glm-4.5-think,LRM,glm,19,The chef cooked the meal that delighted the guests who thanked the waiter who bowed.,relative pronoun: who
glm-4.5-think,LRM,glm,19,The storm destroyed the house that crushed the car that damaged the fence which fell.,relative pronoun: which
glm-4.5-think,LRM,glm,19,The teacher graded the exam that frustrated the student who failed the test which mattered.,relative pronoun: who
glm-4.5-think,LRM,glm,19,The virus infected the computer that crashed the system that corrupted the files which disappeared.,relative pronoun: which
glm-4.5-think,LRM,glm,19,The child dropped the glass that broke the plate that cut the finger which bled.,relative pronoun: which
glm-4.5-think,LRM,glm,20,"The ball kicked by the boy, thrown by the girl, and chased and caught by the dog.",coordination (and/or)
glm-4.5-think,LRM,glm,20,"The book written by the teacher, read by the student, and cataloged and shelved by the librarian.",coordination (and/or)
glm-4.5-think,LRM,glm,20,"The cake baked by the baker, frosted by the decorator, and admired and eaten by the child.",coordination (and/or)
glm-4.5-think,LRM,glm,20,"The house designed by the architect, constructed by the builder, and painted and furnished by the owner.",coordination (and/or)
glm-4.5-think,LRM,glm,20,"The car engineered by the engineer, repaired by the mechanic, and driven and washed by the driver.",coordination (and/or)
glm-4.5-think,LRM,glm,21,The sun heats the wind.,wrong length: 5 words (expected 12 or 15)
glm-4.5-think,LRM,glm,21,The wind blows the tree.,wrong length: 5 words (expected 12 or 15)
glm-4.5-think,LRM,glm,21,The tree pushes the rock.,wrong length: 5 words (expected 12 or 15)
glm-4.5-think,LRM,glm,21,The rock breaks.,wrong length: 3 words (expected 12 or 15)
glm-4.5-think,LRM,glm,21,The rock breaks completely.,wrong length: 4 words (expected 12 or 15)
glm-4.5-think,LRM,glm,22,"The chef prepared the meal, the waiter served the meal, the critic tasted the meal, and the meal cooled.",coordination (and/or)
glm-4.5-think,LRM,glm,22,"The teacher graded the exam, the student took the exam, the proctor monitored the exam, and the exam vanished.",coordination (and/or)
glm-4.5-think,LRM,glm,22,"The artist painted the mural, the vandal defaced the mural, the photographer captured the mural, and the mural faded.",coordination (and/or)
glm-4.5-think,LRM,glm,22,"The gardener watered the plants, the deer ate the plants, the child picked the plants, and the plants wilted.",coordination (and/or)
glm-4.5-think,LRM,glm,22,"The mechanic repaired the engine, the driver tested the engine, the inspector examined the engine, and the engine rumbled.",coordination (and/or)
glm-4.5-think,LRM,glm,23,"The sun, moon, stars, planets radiate, glow, twinkle, shine.",wrong length: 9 words (expected 12 or 15)
glm-4.5-think,LRM,glm,23,"Waves, wind, rain, thunder crash, blow, fall, roar.",wrong length: 8 words (expected 12 or 15)
glm-4.5-think,LRM,glm,23,"Flowers, trees, grass, leaves bloom, grow, sway, rustle.",wrong length: 8 words (expected 12 or 15)
glm-4.5-think,LRM,glm,23,"Cars, buses, trucks, bikes move, stop, turn, park.",wrong length: 8 words (expected 12 or 15)
glm-4.5-think,LRM,glm,23,"Chefs, waiters, managers, hosts cook, serve, manage, greet.",wrong length: 8 words (expected 12 or 15)
glm-4.5-think,LRM,glm,24,The dog chases the cat.,wrong length: 5 words (expected 12 or 15)
glm-4.5-think,LRM,glm,24,The bird catches the dog.,wrong length: 5 words (expected 12 or 15)
glm-4.5-think,LRM,glm,24,The fish eats the bird.,wrong length: 5 words (expected 12 or 15)
glm-4.5-think,LRM,glm,24,The cat sees the fish.,wrong length: 5 words (expected 12 or 15)
glm-4.5-think,LRM,glm,24,This completes the cycle.,wrong length: 4 words (expected 12 or 15)
glm-4.5-think,LRM,glm,25,The fish ate the bird.,wrong length: 5 words (expected 12 or 15)
glm-4.5-think,LRM,glm,25,The bird bit the dog.,wrong length: 5 words (expected 12 or 15)
glm-4.5-think,LRM,glm,25,The dog chased the cat.,wrong length: 5 words (expected 12 or 15)
glm-4.5-think,LRM,glm,25,The cat slept.,wrong length: 3 words (expected 12 or 15)
glm-4.5-think,LRM,glm,25,The fish slept.,wrong length: 3 words (expected 12 or 15)
glm-4.5-think,LRM,glm,26,"The house that the architect designed, the builder constructed, the family occupied, the storm destroyed.","pos 5 is ""designed"", expected ""that"""
glm-4.5-think,LRM,glm,26,"The book that the author wrote, the editor reviewed, the publisher printed, the reader enjoyed.","pos 5 is ""wrote"", expected ""that"""
glm-4.5-think,LRM,glm,26,"The car that the engineer designed, the factory assembled, the dealer sold, the driver crashed.","pos 5 is ""designed"", expected ""that"""
glm-4.5-think,LRM,glm,26,"The tree that the gardener planted, the children climbed, the birds nested in, the lightning struck.",wrong length: 16 words (expected 12 or 15)
glm-4.5-think,LRM,glm,26,"The painting that the artist created, the collector bought, the museum displayed, the fire damaged.","pos 5 is ""created"", expected ""that"""
glm-4.5-think,LRM,glm,27,"Cats, dogs, birds, and fish run, jump, swim, and sleep.",coordination (and/or)
glm-4.5-think,LRM,glm,27,"Students, teachers, parents, and principals read, write, discuss, and listen.",coordination (and/or)
glm-4.5-think,LRM,glm,27,"Cars, buses, trains, and planes drive, move, travel, and fly.",coordination (and/or)
glm-4.5-think,LRM,glm,27,"Apples, oranges, bananas, and grapes grow, ripen, fall, and rot.",coordination (and/or)
glm-4.5-think,LRM,glm,27,"Children, adults, men, and women play, work, rest, and dream.",coordination (and/or)
glm-4.5-think,LRM,glm,28,Students teachers books desks studied wrote read learned.,wrong length: 8 words (expected 12 or 15)
glm-4.5-think,LRM,glm,28,Cars trucks buses trains drove sped parked stopped.,wrong length: 8 words (expected 12 or 15)
glm-4.5-think,LRM,glm,28,Cats dogs mice birds chased ran jumped flew.,wrong length: 8 words (expected 12 or 15)
glm-4.5-think,LRM,glm,28,Roses daisies tulips lilies bloomed wilted grew withered.,wrong length: 8 words (expected 12 or 15)
glm-4.5-think,LRM,glm,28,Computers phones tablets laptops processed stored displayed connected.,wrong length: 8 words (expected 12 or 15)
glm-4.5-think,LRM,glm,29,The book was on the table.,wrong length: 6 words (expected 12 or 15)
glm-4.5-think,LRM,glm,29,The teacher opened the book.,wrong length: 5 words (expected 12 or 15)
glm-4.5-think,LRM,glm,29,The student read the book.,wrong length: 5 words (expected 12 or 15)
glm-4.5-think,LRM,glm,29,The librarian closed the book.,wrong length: 5 words (expected 12 or 15)
glm-4.5-think,LRM,glm,29,The librarian shelved the book.,wrong length: 5 words (expected 12 or 15)
glm-4.5-think,LRM,glm,30,Run jump swim fly the dog cat bird fish.,wrong length: 9 words (expected 12 or 15)
glm-4.5-think,LRM,glm,30,Eat drink sleep play the apple banana orange grape.,wrong length: 9 words (expected 12 or 15)
glm-4.5-think,LRM,glm,30,Read write speak listen the book magazine newspaper letter.,wrong length: 9 words (expected 12 or 15)
glm-4.5-think,LRM,glm,30,Walk run jog sprint the street park garden path.,wrong length: 9 words (expected 12 or 15)
glm-4.5-think,LRM,glm,30,Cook bake fry boil the chicken rice vegetable soup.,wrong length: 9 words (expected 12 or 15)
qwen3-30b-a3b,LLM,qwen,1,The cat the teacher the doctor the nurse smiled smiled laughed.,wrong length: 11 words (expected 12 or 15)
qwen3-30b-a3b,LLM,qwen,1,The book the student the worker the artist read read wrote.,wrong length: 11 words (expected 12 or 15)
qwen3-30b-a3b,LLM,qwen,1,The car the driver the cyclist the pedestrian moved moved stopped.,wrong length: 11 words (expected 12 or 15)
qwen3-30b-a3b,LLM,qwen,1,The song the singer the musician the composer played played created.,wrong length: 11 words (expected 12 or 15)
qwen3-30b-a3b,LLM,qwen,1,The project the manager the developer the designer completed completed launched.,wrong length: 11 words (expected 12 or 15)
qwen3-30b-a3b,LLM,qwen,3,The shadow the spy the guard the soldier vanished.,wrong length: 9 words (expected 12 or 15)
qwen3-30b-a3b,LLM,qwen,3,The silence the priest the teacher the doctor vanished.,wrong length: 9 words (expected 12 or 15)
qwen3-30b-a3b,LLM,qwen,3,The echo the dancer the singer the actor vanished.,wrong length: 9 words (expected 12 or 15)
qwen3-30b-a3b,LLM,qwen,3,The memory the historian the scholar the writer vanished.,wrong length: 9 words (expected 12 or 15)
qwen3-30b-a3b,LLM,qwen,3,The light the engineer the architect the builder vanished.,wrong length: 9 words (expected 12 or 15)
qwen3-30b-a3b,LLM,qwen,5,A document is drafted by Agent A and passed to Agent B for review.,coordination (and/or)
qwen3-30b-a3b,LLM,qwen,5,Agent B annotates the document with corrections and forwards it to Agent C for approval.,coordination (and/or)
qwen3-30b-a3b,LLM,qwen,5,"Agent C verifies the changes, signs the document digitally, and sends it to a secure server.",coordination (and/or)
qwen3-30b-a3b,LLM,qwen,5,The original draft disappears from the shared drive after the signed version is archived.,wrong length: 14 words (expected 12 or 15)
qwen3-30b-a3b,LLM,qwen,5,All agents receive a notification confirming the document's final status and removal from circulation.,coordination (and/or)
qwen3-30b-a3b,LLM,qwen,8,The shadow the guardian the watcher the sentinel vanished.,wrong length: 9 words (expected 12 or 15)
qwen3-30b-a3b,LLM,qwen,8,The silence the listener the observer the witness vanished.,wrong length: 9 words (expected 12 or 15)
qwen3-30b-a3b,LLM,qwen,8,The memory the keeper the recorder the historian vanished.,wrong length: 9 words (expected 12 or 15)
qwen3-30b-a3b,LLM,qwen,8,The light the guide the beacon the illuminator vanished.,wrong length: 9 words (expected 12 or 15)
qwen3-30b-a3b,LLM,qwen,8,The truth the seeker the finder the decoder vanished.,wrong length: 9 words (expected 12 or 15)
qwen3-30b-a3b,LLM,qwen,9,The shadow the guardian the watcher the sentinel vanished.,wrong length: 9 words (expected 12 or 15)
qwen3-30b-a3b,LLM,qwen,9,The silence the listener the observer the witness vanished.,wrong length: 9 words (expected 12 or 15)
qwen3-30b-a3b,LLM,qwen,9,The memory the keeper the recorder the historian vanished.,wrong length: 9 words (expected 12 or 15)
qwen3-30b-a3b,LLM,qwen,9,The light the guide the beacon the mentor vanished.,wrong length: 9 words (expected 12 or 15)
qwen3-30b-a3b,LLM,qwen,9,The hope the dreamer the believer the seeker vanished.,wrong length: 9 words (expected 12 or 15)
qwen3-30b-a3b,LLM,qwen,10,A junior designer drafted the initial concept based on client requirements.,wrong length: 11 words (expected 12 or 15)
qwen3-30b-a3b,LLM,qwen,10,The team lead reviewed the design and suggested revisions to improve usability.,coordination (and/or)
qwen3-30b-a3b,LLM,qwen,10,The department manager approved the updated version after confirming alignment with company standards.,wrong length: 13 words (expected 12 or 15)
qwen3-30b-a3b,LLM,qwen,10,The senior executive endorsed the final design during the weekly board meeting.,"pos 2 is ""executive"", expected det (the/a)"
qwen3-30b-a3b,LLM,qwen,10,"Once implemented, the original files were permanently deleted to maintain security protocols.","pos 0 is ""once"", expected det (the/a)"
qwen3-30b-a3b,LLM,qwen,16,The researcher encrypted the sensitive data and stored it in a secure server.,coordination (and/or)
qwen3-30b-a3b,LLM,qwen,16,The system administrator backed up the file to an off-site location for redundancy.,wrong length: 13 words (expected 12 or 15)
qwen3-30b-a3b,LLM,qwen,16,A junior analyst accidentally shared the backup link via an unsecured messaging app.,wrong length: 13 words (expected 12 or 15)
qwen3-30b-a3b,LLM,qwen,16,The link was intercepted by a hacker who deleted the file and replaced it with a fake version.,relative pronoun: who
qwen3-30b-a3b,LLM,qwen,16,"By the time the breach was detected, the original information had vanished without a trace.","pos 0 is ""by"", expected det (the/a)"
qwen3-30b-a3b,LLM,qwen,17,The shadow the spy the agent the guard vanished.,wrong length: 9 words (expected 12 or 15)
qwen3-30b-a3b,LLM,qwen,17,The silence the listener the watcher the observer vanished.,wrong length: 9 words (expected 12 or 15)
qwen3-30b-a3b,LLM,qwen,17,The memory the historian the scholar the archivist vanished.,wrong length: 9 words (expected 12 or 15)
qwen3-30b-a3b,LLM,qwen,17,The light the beacon the guide the signal vanished.,wrong length: 9 words (expected 12 or 15)
qwen3-30b-a3b,LLM,qwen,17,The hope the leader the mentor the guide vanished.,wrong length: 9 words (expected 12 or 15)
qwen3-30b-a3b,LLM,qwen,18,The project the leader the team member the consultant planned executed reviewed completed.,wrong length: 13 words (expected 12 or 15)
qwen3-30b-a3b,LLM,qwen,19,"The detective entered the abandoned mansion, assuming the role of a curious historian.",wrong length: 13 words (expected 12 or 15)
qwen3-30b-a3b,LLM,qwen,19,"Inside, she discovered a hidden chamber where a librarian was cataloging ancient texts, pretending to be a ghost.",relative pronoun: where
qwen3-30b-a3b,LLM,qwen,19,"The librarian, in turn, revealed a mirror that reflected not the room, but a different world where a traveler was waiting to be summoned.",relative pronoun: where
qwen3-30b-a3b,LLM,qwen,19,"The traveler stepped through the mirror, erasing the librarian from existence as they merged into a single entity.",wrong length: 18 words (expected 12 or 15)
qwen3-30b-a3b,LLM,qwen,19,"With the traveler now fully present, the detective vanished, absorbed into the narrative of the world beyond the mirror.",wrong length: 19 words (expected 12 or 15)
qwen3-30b-a3b,LLM,qwen,23,A chef prepares a piece of raw meat on a cutting board.,"pos 2 is ""prepares"", expected det (the/a)"
qwen3-30b-a3b,LLM,qwen,23,A cook slices the meat into thin strips and places it in a bowl.,coordination (and/or)
qwen3-30b-a3b,LLM,qwen,23,A server carries the bowl to the dining table and sets it before a guest.,coordination (and/or)
qwen3-30b-a3b,LLM,qwen,23,"The guest uses chopsticks to eat the meat, reducing it to small fragments.",wrong length: 13 words (expected 12 or 15)
qwen3-30b-a3b,LLM,qwen,23,"As the last bite is consumed, the plate is empty and the item has disappeared.",coordination (and/or)
qwen3-30b-a3b,LLM,qwen,28,The shadow the guard the watcher the watcher the guard vanished.,wrong length: 11 words (expected 12 or 15)
qwen3-30b-a3b,LLM,qwen,28,The silence the spy the sentinel the watcher the spy vanished.,wrong length: 11 words (expected 12 or 15)
qwen3-30b-a3b,LLM,qwen,28,The echo the messenger the courier the courier the messenger vanished.,wrong length: 11 words (expected 12 or 15)
qwen3-30b-a3b,LLM,qwen,28,The light the priest the sage the sage the priest vanished.,wrong length: 11 words (expected 12 or 15)
qwen3-30b-a3b,LLM,qwen,28,The memory the historian the archivist the archivist the historian vanished.,wrong length: 11 words (expected 12 or 15)
qwen3-30b-a3b,LLM,qwen,30,The cat the chef the waiter the manager ordered the food the drink the dessert the meal.,wrong length: 17 words (expected 12 or 15)
qwen3-30b-a3b,LLM,qwen,30,The dog the teacher the student the parent laughed the cry the run the jump the dance.,wrong length: 17 words (expected 12 or 15)
qwen3-30b-a3b,LLM,qwen,30,The bird the pilot the passenger the crew flew the plane the sky the route the destination the landing.,wrong length: 19 words (expected 12 or 15)
qwen3-30b-a3b,LLM,qwen,30,The book the author the editor the publisher released the story the chapter the page the ending the review.,wrong length: 19 words (expected 12 or 15)
qwen3-30b-a3b,LLM,qwen,30,The car the driver the passenger the mechanic fixed the engine the brake the tire the transmission the road.,wrong length: 19 words (expected 12 or 15)
qwen3-30b-a3b-think,LRM,qwen,1,The sun moon stars planets shone glittered danced floated,wrong length: 9 words (expected 12 or 15)
qwen3-30b-a3b-think,LRM,qwen,1,The river stream waterfall lake flowed splashed gurgled sparkled,wrong length: 9 words (expected 12 or 15)
qwen3-30b-a3b-think,LRM,qwen,1,The book page chapter story read explored understood enjoyed,wrong length: 9 words (expected 12 or 15)
qwen3-30b-a3b-think,LRM,qwen,1,The car engine wheel tire drove accelerated braked honked,wrong length: 9 words (expected 12 or 15)
qwen3-30b-a3b-think,LRM,qwen,1,The teacher student class lesson taught explained answered encouraged,wrong length: 9 words (expected 12 or 15)
qwen3-30b-a3b-think,LRM,qwen,2,Team the Manager the Designer the Developer leads creates builds tests.,wrong length: 11 words (expected 12 or 15)
qwen3-30b-a3b-think,LRM,qwen,2,Team the Manager the Designer the Developer leads designs develops tests.,wrong length: 11 words (expected 12 or 15)
qwen3-30b-a3b-think,LRM,qwen,2,Team the Manager the Designer the Developer leads collaborates codes reviews.,wrong length: 11 words (expected 12 or 15)
qwen3-30b-a3b-think,LRM,qwen,2,Team the Manager the Designer the Developer leads coordinates prototypes validates.,wrong length: 11 words (expected 12 or 15)
qwen3-30b-a3b-think,LRM,qwen,2,Team the Manager the Designer the Developer leads innovates implements evaluates.,wrong length: 11 words (expected 12 or 15)
qwen3-30b-a3b-think,LRM,qwen,7,The detective observes the shadow vanish into the mist.,wrong length: 9 words (expected 12 or 15)
qwen3-30b-a3b-think,LRM,qwen,7,The scientist discovers the shadow's hidden pattern in the data.,wrong length: 10 words (expected 12 or 15)
qwen3-30b-a3b-think,LRM,qwen,7,The child watches the shadow fade away completely.,wrong length: 8 words (expected 12 or 15)
qwen3-30b-a3b-think,LRM,qwen,7,The detective tracks the shadow's movement across the city.,wrong length: 9 words (expected 12 or 15)
qwen3-30b-a3b-think,LRM,qwen,7,The scientist explains how shadows vanish under certain light conditions.,wrong length: 10 words (expected 12 or 15)
qwen3-30b-a3b-think,LRM,qwen,15,The sun shines brightly.,wrong length: 4 words (expected 12 or 15)
qwen3-30b-a3b-think,LRM,qwen,15,The tree grows slowly.,wrong length: 4 words (expected 12 or 15)
qwen3-30b-a3b-think,LRM,qwen,15,The bird flies high.,wrong length: 4 words (expected 12 or 15)
qwen3-30b-a3b-think,LRM,qwen,15,The river flows steadily.,wrong length: 4 words (expected 12 or 15)
qwen3-30b-a3b-think,LRM,qwen,15,The sun shines and the bird flies.,coordination (and/or)
qwen3-30b-a3b-think,LRM,qwen,17,Alice ran.,wrong length: 2 words (expected 12 or 15)
qwen3-30b-a3b-think,LRM,qwen,17,Bob jumped.,wrong length: 2 words (expected 12 or 15)
qwen3-30b-a3b-think,LRM,qwen,17,Charlie sang.,wrong length: 2 words (expected 12 or 15)
qwen3-30b-a3b-think,LRM,qwen,17,Diana danced.,wrong length: 2 words (expected 12 or 15)
qwen3-30b-a3b-think,LRM,qwen,17,They all celebrated together.,wrong length: 4 words (expected 12 or 15)
qwen3-30b-a3b-think,LRM,qwen,21,apple banana orange grape run jump eat sleep.,wrong length: 8 words (expected 12 or 15)
qwen3-30b-a3b-think,LRM,qwen,21,car truck bus train drive fly park stop.,wrong length: 8 words (expected 12 or 15)
qwen3-30b-a3b-think,LRM,qwen,21,book pen paper pencil write draw read type.,wrong length: 8 words (expected 12 or 15)
qwen3-30b-a3b-think,LRM,qwen,21,sun moon star planet shine glow travel orbit.,wrong length: 8 words (expected 12 or 15)
qwen3-30b-a3b-think,LRM,qwen,21,water fire air earth boil burn cool freeze.,wrong length: 8 words (expected 12 or 15)
qwen3-30b-a3b-think,LRM,qwen,24,The cat jumped over the fence.,wrong length: 6 words (expected 12 or 15)
qwen3-30b-a3b-think,LRM,qwen,24,The book opened by itself.,wrong length: 5 words (expected 12 or 15)
qwen3-30b-a3b-think,LRM,qwen,24,The car rolled down the hill.,wrong length: 6 words (expected 12 or 15)
qwen3-30b-a3b-think,LRM,qwen,24,The cat sang a cheerful tune.,wrong length: 6 words (expected 12 or 15)
qwen3-30b-a3b-think,LRM,qwen,24,The book jumped onto the table.,wrong length: 6 words (expected 12 or 15)
qwen3-30b-a3b-think,LRM,qwen,27,dog cat bird fish run jump swim bark.,wrong length: 8 words (expected 12 or 15)
